Date	Array	Tree	Height	Temp	Time	Real_time	file_name	Treatment	surf_temp	temp_10cm	vwc	pcpn	amb_P	air_temp_bot	RH_bot	vol	area	AtmPress
18/12/2020	6	5846	70	10.2	09:11:50	09:14:50	micro_2020-12-18_f0000.txt	eCO2	8.59	7.82	17.7	0	990.88	11.9	93.88	0.0042535	0.02835	99.088
18/12/2020	6	5844	70	10.4	09:19:48	09:22:48	micro_2020-12-18_f0000.txt	eCO2	8.59	7.82	17.7	0	990.88	11.9	93.88	0.0042535	0.02835	99.088
18/12/2020	6	5850	70	11	09:27:40	09:30:40	micro_2020-12-18_f0000.txt	eCO2	8.59	7.82	17.7	0	990.88	11.9	93.88	0.0042535	0.02835	99.088
18/12/2020	5	6387	70	11	09:38:00	09:41:00	micro_2020-12-18_f0000.txt	aCO2	8.66	7.8	25.07	0	990.88	11.9	93.88	0.0042535	0.02835	99.088
18/12/2020	5	6384	70	10.9	09:46:50	09:49:50	micro_2020-12-18_f0000.txt	aCO2	8.66	7.8	25.07	0	990.88	11.9	93.88	0.0042535	0.02835	99.088
18/12/2020	5	6382	70	13	09:54:18	09:57:18	micro_2020-12-18_f0000.txt	aCO2	8.66	7.8	25.07	0	990.88	11.9	93.88	0.0042535	0.02835	99.088
18/12/2020	3	8351	70	12.8	10:04:19	10:07:19	micro_2020-12-18_f0000.txt	aCO2	9.2	8.2	23.3	0	989.88	11.99	94.8	0.0042535	0.02835	98.988
18/12/2020	3	8300	70	11.8	10:11:58	10:14:58	micro_2020-12-18_f0000.txt	aCO2	9.2	8.2	23.3	0	989.88	11.99	94.8	0.0042535	0.02835	98.988
18/12/2020	3	9301	70	9.6	10:21:33	10:24:33	micro_2020-12-18_f0000.txt	aCO2	9.2	8.2	23.3	0	989.88	11.99	94.8	0.0042535	0.02835	98.988
18/12/2020	1	8437	70	10.9	10:33:34	10:36:34	micro_2020-12-18_f0000.txt	eCO2	9.68	8.36	21.88	0	989.88	11.99	94.8	0.0042535	0.02835	98.988
18/12/2020	1	8445	70	11.1	10:49:50	10:52:50	micro_2020-12-18_f0000.txt	eCO2	9.68	8.36	21.88	0	989.88	11.99	94.8	0.0042535	0.02835	98.988
18/12/2020	1	8468	70	10.8	10:57:41	11:00:41	micro_2020-12-18_f0000.txt	eCO2	9.91	8.43	21.81	0	989.91	12.06	94.66	0.0042535	0.02835	98.991
18/12/2020	2	8673	70	10.4	11:08:20	11:11:20	micro_2020-12-18_f0000.txt	aCO2	9.48	7.76	23.28	0	989.91	12.06	94.66	0.0042535	0.02835	98.991
18/12/2020	2	8668	70	10.7	11:15:40	11:18:40	micro_2020-12-18_f0000.txt	aCO2	9.48	7.76	23.28	0	989.91	12.06	94.66	0.0042535	0.02835	98.991
18/12/2020	2	8749	70	13.4	11:23:02	11:26:02	micro_2020-12-18_f0000.txt	aCO2	9.48	7.76	23.28	0	989.91	12.06	94.66	0.0042535	0.02835	98.991
18/12/2020	4	6574	70	10.5	11:45:08	11:48:08	micro_2020-12-18_f0001.txt	eCO2	9.23	8.05	25.64	0	989.91	12.06	94.66	0.0042535	0.02835	98.991
18/12/2020	4	6518	70	10.9	11:53:02	11:56:02	micro_2020-12-18_f0001.txt	eCO2	9.23	8.05	25.64	0	989.91	12.06	94.66	0.0042535	0.02835	98.991
22/01/2021	6	5846	70	1.6	11:05:32	11:01:32	micro_2021-01-22_f0000.txt	eCO2	3.53	5.28	18.27	0	977.67	4.33	81.42	0.0042535	0.02835	97.767
22/01/2021	6	5844	70	2.1	11:13:50	11:09:50	micro_2021-01-22_f0000.txt	eCO2	3.53	5.28	18.27	0	977.67	4.33	81.42	0.0042535	0.02835	97.767
22/01/2021	6	5850	70	2	11:24:22	11:20:22	micro_2021-01-22_f0000.txt	eCO2	3.53	5.28	18.27	0	977.67	4.33	81.42	0.0042535	0.02835	97.767
22/01/2021	5	6387	70	2.2	10:38:05	10:34:05	micro_2021-01-22_f0000.txt	aCO2	3.5	4.36	27.05	0	977.54	2.77	90.3	0.0042535	0.02835	97.754
22/01/2021	5	6384	70	1.1	10:46:00	10:42:00	micro_2021-01-22_f0000.txt	aCO2	3.5	4.36	27.05	0	977.54	2.77	90.3	0.0042535	0.02835	97.754
22/01/2021	5	6382	70	3.1	10:53:35	10:49:35	micro_2021-01-22_f0000.txt	aCO2	3.5	4.36	27.05	0	977.54	2.77	90.3	0.0042535	0.02835	97.754
22/01/2021	3	8351	70	1.1	09:48:09	09:44:09	micro_2021-01-22_f0000.txt	aCO2	3.64	5.21	26.25	0	977.21	-0.54	97.48	0.0042535	0.02835	97.721
22/01/2021	3	8300	70	3.2	09:56:30	09:52:30	micro_2021-01-22_f0000.txt	aCO2	3.64	5.21	26.25	0	977.21	-0.54	97.48	0.0042535	0.02835	97.721
22/01/2021	3	9301	70	2.7	10:04:04	10:00:04	micro_2021-01-22_f0000.txt	aCO2	3.78	5.17	26.24	0	977.54	2.77	90.3	0.0042535	0.02835	97.754
22/01/2021	1	8437	70	4.3	10:28:28	10:24:28	micro_2021-01-22_f0000.txt	eCO2	2.74	5.24	25.01	0	977.54	2.77	90.3	0.0042535	0.02835	97.754
22/01/2021	1	8445	70	3.8	10:13:56	10:09:56	micro_2021-01-22_f0000.txt	eCO2	2.74	5.24	25.01	0	977.54	2.77	90.3	0.0042535	0.02835	97.754
22/01/2021	1	8468	70	4.9	10:21:03	10:17:03	micro_2021-01-22_f0000.txt	eCO2	2.74	5.24	25.01	0	977.54	2.77	90.3	0.0042535	0.02835	97.754
22/01/2021	2	8673	70	0	09:21:37	09:17:37	micro_2021-01-22_f0000.txt	aCO2	3.02	5.08	25	0	977.21	-0.54	97.48	0.0042535	0.02835	97.721
22/01/2021	2	8668	70	0.7	09:36:35	09:32:35	micro_2021-01-22_f0000.txt	aCO2	3.02	5.08	25	0	977.21	-0.54	97.48	0.0042535	0.02835	97.721
22/01/2021	2	8749	70	-0.2	09:29:18	09:25:18	micro_2021-01-22_f0000.txt	aCO2	3.02	5.08	25	0	977.21	-0.54	97.48	0.0042535	0.02835	97.721
22/01/2021	4	6574	70	-2.4	09:04:50	09:00:50	micro_2021-01-22_f0000.txt	eCO2	3.03	4.64	28.06	0	977.21	-0.54	97.48	0.0042535	0.02835	97.721
22/01/2021	4	6518	70	-1.5	09:12:25	09:08:25	micro_2021-01-22_f0000.txt	eCO2	3.03	4.64	28.06	0	977.21	-0.54	97.48	0.0042535	0.02835	97.721
24/02/2021	4	6574	70	15.4	10:16:50	10:10:50	micro_2021-02-24_f0000.txt	eCO2	9.12	7.46	26.58	0	1003	12.82	87.37	0.0042535	0.02835	100.3
24/02/2021	4	6580	70	15.6	10:23:49	10:17:49	micro_2021-02-24_f0000.txt	eCO2	9.12	7.46	26.58	0	1003	12.82	87.37	0.0042535	0.02835	100.3
24/02/2021	4	6622	70	15.4	10:32:30	10:26:30	micro_2021-02-24_f0000.txt	eCO2	9.12	7.46	26.58	0	1003	12.82	87.37	0.0042535	0.02835	100.3
24/02/2021	4	6518	70	14.9	10:39:44	10:33:44	micro_2021-02-24_f0000.txt	eCO2	9.12	7.46	26.58	0	1003	12.82	87.37	0.0042535	0.02835	100.3
24/02/2021	4	6516	70	14.7	10:48:17	10:42:17	micro_2021-02-24_f0000.txt	eCO2	9.12	7.46	26.58	0	1003	12.82	87.37	0.0042535	0.02835	100.3
24/02/2021	2	8689	70	14.3	10:58:53	10:52:53	micro_2021-02-24_f0000.txt	aCO2	9.39	7.1	22.75	0	1003	12.82	87.37	0.0042535	0.02835	100.3
24/02/2021	2	8676	70	13.2	11:07:40	11:01:40	micro_2021-02-24_f0000.txt	aCO2	9.67	7.18	22.7	0	1003.04	13.76	81.86	0.0042535	0.02835	100.304
24/02/2021	2	8673	70	15.7	11:14:55	11:08:55	micro_2021-02-24_f0000.txt	aCO2	9.67	7.18	22.7	0	1003.04	13.76	81.86	0.0042535	0.02835	100.304
24/02/2021	2	8749	70	14.5	11:22:40	11:16:40	micro_2021-02-24_f0000.txt	aCO2	9.67	7.18	22.7	0	1003.04	13.76	81.86	0.0042535	0.02835	100.304
24/02/2021	2	8668	70	15	11:29:50	11:23:50	micro_2021-02-24_f0000.txt	aCO2	9.67	7.18	22.7	0	1003.04	13.76	81.86	0.0042535	0.02835	100.304
24/02/2021	5	6373	70	10.7	11:40:00	11:34:00	micro_2021-02-24_f0000.txt	aCO2	9.32	7.65	23.98	0	1003.04	13.76	81.86	0.0042535	0.02835	100.304
24/02/2021	5	6387	70	12.1	11:47:02	11:41:02	micro_2021-02-24_f0000.txt	aCO2	9.32	7.65	23.98	0	1003.04	13.76	81.86	0.0042535	0.02835	100.304
24/02/2021	5	6384	70	12.1	11:54:35	11:48:35	micro_2021-02-24_f0000.txt	aCO2	9.32	7.65	23.98	0	1003.04	13.76	81.86	0.0042535	0.02835	100.304
24/02/2021	5	6383	70	13.1	12:01:46	11:55:46	micro_2021-02-24_f0000.txt	aCO2	9.32	7.65	23.98	0	1003.04	13.76	81.86	0.0042535	0.02835	100.304
24/02/2021	5	6406	70	13.2	12:08:46	12:02:46	micro_2021-02-24_f0000.txt	aCO2	9.59	7.73	23.96	0	1002.59	14.22	77.36	0.0042535	0.02835	100.259
24/02/2021	6	5846	70	14.7	12:18:00	12:12:00	micro_2021-02-24_f0000.txt	eCO2	9.49	7.7	17.25	0	1002.59	14.22	77.36	0.0042535	0.02835	100.259
24/02/2021	6	5844	70	14.6	12:26:19	12:20:19	micro_2021-02-24_f0000.txt	eCO2	9.49	7.7	17.25	0	1002.59	14.22	77.36	0.0042535	0.02835	100.259
24/02/2021	6	5850	70	14.4	12:34:20	12:28:20	micro_2021-02-24_f0000.txt	eCO2	9.49	7.7	17.25	0	1002.59	14.22	77.36	0.0042535	0.02835	100.259
24/02/2021	6	3752	70	14.2	12:42:06	12:36:06	micro_2021-02-24_f0000.txt	eCO2	9.49	7.7	17.25	0	1002.59	14.22	77.36	0.0042535	0.02835	100.259
24/02/2021	6	3750	70	14.5	12:49:03	12:43:03	micro_2021-02-24_f0000.txt	eCO2	9.49	7.7	17.25	0	1002.59	14.22	77.36	0.0042535	0.02835	100.259
24/02/2021	3	8357	70	13.7	13:11:44	13:05:44	micro_2021-02-24_f0001.txt	aCO2	9.66	7.47	21.4	0	1002.12	14.3	78.02	0.0042535	0.02835	100.212
24/02/2021	3	8351	70	14.7	13:18:38	13:12:38	micro_2021-02-24_f0001.txt	aCO2	9.66	7.47	21.4	0	1002.12	14.3	78.02	0.0042535	0.02835	100.212
24/02/2021	3	8345	70	15.4	13:26:01	13:20:01	micro_2021-02-24_f0001.txt	aCO2	9.66	7.47	21.4	0	1002.12	14.3	78.02	0.0042535	0.02835	100.212
24/02/2021	3	8300	70	12.3	13:33:33	13:27:33	micro_2021-02-24_f0001.txt	aCO2	9.66	7.47	21.4	0	1002.12	14.3	78.02	0.0042535	0.02835	100.212
24/02/2021	3	9301	70	14.3	13:41:24	13:35:24	micro_2021-02-24_f0001.txt	aCO2	9.66	7.47	21.4	0	1002.12	14.3	78.02	0.0042535	0.02835	100.212
24/02/2021	1	8433	70	15.2	13:50:40	13:44:40	micro_2021-02-24_f0001.txt	eCO2	10.91	7.93	21.25	0	1002.12	14.3	78.02	0.0042535	0.02835	100.212
24/02/2021	1	8445	70	15.1	13:57:57	13:51:57	micro_2021-02-24_f0001.txt	eCO2	10.91	7.93	21.25	0	1002.12	14.3	78.02	0.0042535	0.02835	100.212
24/02/2021	1	8468	70	15.4	14:05:58	13:59:58	micro_2021-02-24_f0001.txt	eCO2	10.91	7.93	21.25	0	1002.12	14.3	78.02	0.0042535	0.02835	100.212
24/02/2021	1	8446	70	15	14:13:35	14:07:35	micro_2021-02-24_f0001.txt	eCO2	11.28	8	21.25	0	1001.82	14.59	76.47	0.0042535	0.02835	100.182
24/02/2021	1	8437	70	14.7	14:22:18	14:16:18	micro_2021-02-24_f0001.txt	eCO2	11.28	8	21.25	0	1001.82	14.59	76.47	0.0042535	0.02835	100.182
25/02/2021	6	5846	30	12.7	13:06:30	13:06:30	micro_2021-02-25_f0002.txt	eCO2	8.29	7.58	16.42	0	1012	10.85	57.95	0.002043	0.03178	101.2
25/02/2021	6	5846	150	12.7	13:14:58	13:14:58	micro_2021-02-25_f0002.txt	eCO2	8.29	7.58	16.42	0	1012	10.85	57.95	0.002043	0.03178	101.2
25/02/2021	6	5846	250	12	13:23:00	13:23:00	micro_2021-02-25_f0002.txt	eCO2	8.29	7.58	16.42	0	1012	10.85	57.95	0.002043	0.03178	101.2
25/02/2021	6	5846	400	12.3	13:30:38	13:30:38	micro_2021-02-25_f0002.txt	eCO2	8.29	7.58	16.42	0	1012	10.85	57.95	0.002043	0.03178	101.2
25/02/2021	6	5850	30	10.3	13:39:06	13:39:06	micro_2021-02-25_f0002.txt	eCO2	8.29	7.58	16.42	0	1012	10.85	57.95	0.002043	0.03178	101.2
25/02/2021	6	5850	150	10.1	14:17:12	14:17:12	micro_2021-02-25_f0002.txt	eCO2	8.54	7.63	16.92	0	1012.91	10.59	55.86	0.002043	0.03178	101.291
25/02/2021	6	5850	250	11.5	14:08:30	14:08:30	micro_2021-02-25_f0002.txt	eCO2	8.54	7.63	16.92	0	1012.91	10.59	55.86	0.002043	0.03178	101.291
25/02/2021	6	5850	400	8.5	14:34:40	14:34:40	micro_2021-02-25_f0002.txt	eCO2	8.54	7.63	16.92	0	1012.91	10.59	55.86	0.002043	0.03178	101.291
25/02/2021	6	3752	30	11.5	14:45:30	14:45:30	micro_2021-02-25_f0002.txt	eCO2	8.54	7.63	16.92	0	1012.91	10.59	55.86	0.002043	0.03178	101.291
25/02/2021	6	3752	150	12.9	15:05:30	15:05:30	micro_2021-02-25_f0003.txt	eCO2	8.36	7.67	16.85	0	1013.08	10.37	56.28	0.002043	0.03178	101.308
25/02/2021	6	3752	250	10.8	15:16:45	15:16:45	micro_2021-02-25_f0003.txt	eCO2	8.36	7.67	16.85	0	1013.08	10.37	56.28	0.002043	0.03178	101.308
25/02/2021	6	3752	400	10.7	15:25:30	15:25:30	micro_2021-02-25_f0003.txt	eCO2	8.36	7.67	16.85	0	1013.08	10.37	56.28	0.002043	0.03178	101.308
25/02/2021	5	6382	30	13.6	15:40:00	15:40:00	micro_2021-02-25_f0003.txt	aCO2	8.39	7.57	23.59	0	1013.08	10.37	56.28	0.002043	0.03178	101.308
25/02/2021	5	6382	150	13.2	15:51:50	15:51:50	micro_2021-02-25_f0003.txt	aCO2	8.39	7.57	23.59	0	1013.08	10.37	56.28	0.002043	0.03178	101.308
25/02/2021	5	6382	250	12.1	16:03:00	16:03:00	micro_2021-02-25_f0003.txt	aCO2	8.1	7.62	23.6	0	1013.83	9.51	62.83	0.002043	0.03178	101.383
25/02/2021	5	6382	400	11.3	16:13:52	16:13:52	micro_2021-02-25_f0003.txt	aCO2	8.1	7.62	23.6	0	1013.83	9.51	62.83	0.002043	0.03178	101.383
26/02/2021	5	6373	30	3.4	09:31:01	09:31:01	micro_2021-02-26_f0000.txt	aCO2	4.31	5.76	23.48	0	1021.96	2.68	98.85	0.002043	0.03178	102.196
26/02/2021	5	6373	150	4.9	09:47:00	09:47:00	micro_2021-02-26_f0000.txt	aCO2	4.31	5.76	23.48	0	1021.96	2.68	98.85	0.002043	0.03178	102.196
26/02/2021	5	6373	250	4.9	10:02:30	10:02:30	micro_2021-02-26_f0000.txt	aCO2	5.09	5.69	23.48	0	1022.59	6.13	88.27	0.002043	0.03178	102.259
26/02/2021	5	6373	400	4.9	10:25:00	10:25:00	micro_2021-02-26_f0000.txt	aCO2	5.09	5.69	23.48	0	1022.59	6.13	88.27	0.002043	0.03178	102.259
26/02/2021	5	6387	30	6.2	10:38:00	10:38:00	micro_2021-02-26_f0000.txt	aCO2	5.09	5.69	23.48	0	1022.59	6.13	88.27	0.002043	0.03178	102.259
26/02/2021	5	6387	150	7.8	10:50:50	10:50:50	micro_2021-02-26_f0000.txt	aCO2	5.09	5.69	23.48	0	1022.59	6.13	88.27	0.002043	0.03178	102.259
26/02/2021	5	6387	250	7.6	11:01:20	11:01:20	micro_2021-02-26_f0000.txt	aCO2	6	5.68	23.54	0	1022.96	7.97	79.19	0.002043	0.03178	102.296
26/02/2021	5	6387	400	8.8	11:14:20	11:14:20	micro_2021-02-26_f0000.txt	aCO2	6	5.68	23.54	0	1022.96	7.97	79.19	0.002043	0.03178	102.296
26/02/2021	3	8357	30	9.9	11:28:00	11:28:00	micro_2021-02-26_f0000.txt	aCO2	5.93	6.1	20.82	0	1022.96	7.97	79.19	0.002043	0.03178	102.296
26/02/2021	3	8357	150	10.1	11:38:30	11:38:30	micro_2021-02-26_f0000.txt	aCO2	5.93	6.1	20.82	0	1022.96	7.97	79.19	0.002043	0.03178	102.296
26/02/2021	3	8357	250	9.8	11:49:49	11:49:49	micro_2021-02-26_f0000.txt	aCO2	5.93	6.1	20.82	0	1022.96	7.97	79.19	0.002043	0.03178	102.296
26/02/2021	3	8357	400	9.8	12:02:00	12:02:00	micro_2021-02-26_f0000.txt	aCO2	6.92	6.14	20.8	0	1023.09	9.18	72.18	0.002043	0.03178	102.309
26/02/2021	3	8351	30	9.4	12:11:20	12:11:20	micro_2021-02-26_f0000.txt	aCO2	6.92	6.14	20.8	0	1023.09	9.18	72.18	0.002043	0.03178	102.309
26/02/2021	3	8351	150	10.1	12:22:50	12:22:50	micro_2021-02-26_f0000.txt	aCO2	6.92	6.14	20.8	0	1023.09	9.18	72.18	0.002043	0.03178	102.309
26/02/2021	3	8351	250	10	12:39:30	12:39:30	micro_2021-02-26_f0000.txt	aCO2	6.92	6.14	20.8	0	1023.09	9.18	72.18	0.002043	0.03178	102.309
26/02/2021	3	8351	400	9.9	12:50:28	12:50:28	micro_2021-02-26_f0000.txt	aCO2	6.92	6.14	20.8	0	1023.09	9.18	72.18	0.002043	0.03178	102.309
26/02/2021	3	9301	30	9.8	13:00:24	13:00:24	micro_2021-02-26_f0000.txt	aCO2	7.48	6.22	20.76	0	1022.96	9.95	67.39	0.002043	0.03178	102.296
26/02/2021	3	9301	150	11.2	13:09:00	13:09:00	micro_2021-02-26_f0000.txt	aCO2	7.48	6.22	20.76	0	1022.96	9.95	67.39	0.002043	0.03178	102.296
26/02/2021	3	9301	250	10.9	13:19:20	13:19:20	micro_2021-02-26_f0000.txt	aCO2	7.48	6.22	20.76	0	1022.96	9.95	67.39	0.002043	0.03178	102.296
26/02/2021	3	9301	400	11	13:27:40	13:27:40	micro_2021-02-26_f0000.txt	aCO2	7.48	6.22	20.76	0	1022.96	9.95	67.39	0.002043	0.03178	102.296
26/02/2021	1	8445	30	11.9	14:38:42	14:38:42	micro_2021-02-26_f0000.txt	eCO2	8.73	6.35	20.88	0	1023	10.15	65.03	0.002043	0.03178	102.3
26/02/2021	1	8445	150	13	14:48:15	14:48:15	micro_2021-02-26_f0000.txt	eCO2	8.73	6.35	20.88	0	1023	10.15	65.03	0.002043	0.03178	102.3
26/02/2021	1	8445	250	13.4	14:57:20	14:57:20	micro_2021-02-26_f0000.txt	eCO2	8.73	6.35	20.88	0	1023	10.15	65.03	0.002043	0.03178	102.3
26/02/2021	1	8445	400	14.2	15:12:30	15:12:30	micro_2021-02-26_f0000.txt	eCO2	8.83	6.5	20.87	0	1022.95	10.95	62.44	0.002043	0.03178	102.295
26/02/2021	1	8446	30	14.1	15:23:30	15:23:30	micro_2021-02-26_f0000.txt	eCO2	8.83	6.5	20.87	0	1022.95	10.95	62.44	0.002043	0.03178	102.295
26/02/2021	1	8446	150	14	15:32:20	15:32:20	micro_2021-02-26_f0000.txt	eCO2	8.83	6.5	20.87	0	1022.95	10.95	62.44	0.002043	0.03178	102.295
26/02/2021	1	8446	250	12.9	15:57:24	15:57:24	micro_2021-02-26_f0000.txt	eCO2	8.83	6.5	20.87	0	1022.95	10.95	62.44	0.002043	0.03178	102.295
26/02/2021	1	8446	400	12.7	15:48:30	15:48:30	micro_2021-02-26_f0000.txt	eCO2	8.83	6.5	20.87	0	1022.95	10.95	62.44	0.002043	0.03178	102.295
01/03/2021	1	8437	30	4.2	09:30:40	09:30:40	micro_2021-03-01_f0000.txt	eCO2	3.86	5.36	20.4	0	1019.09	2.56	99.56	0.002043	0.03178	101.909
01/03/2021	1	8437	150	8.2	09:43:30	09:43:30	micro_2021-03-01_f0000.txt	eCO2	3.86	5.36	20.4	0	1019.09	2.56	99.56	0.002043	0.03178	101.909
01/03/2021	1	8437	250	4.3	10:45:40	10:45:40	micro_2021-03-01_f0000.txt	eCO2	4.35	5.36	20.4	0	1019	3.21	99.51	0.002043	0.03178	101.9
01/03/2021	1	8437	400	4.3	11:02:00	11:02:00	micro_2021-03-01_f0000.txt	eCO2	4.87	5.39	20.39	0	1019	3.78	99.39	0.002043	0.03178	101.9
01/03/2021	2	8673	30	5.3	11:28:16	11:28:16	micro_2021-03-01_f0000.txt	aCO2	5.01	5.39	21.84	0	1019	3.78	99.39	0.002043	0.03178	101.9
01/03/2021	2	8673	150	4.4	11:35:55	11:35:55	micro_2021-03-01_f0000.txt	aCO2	5.01	5.39	21.84	0	1019	3.78	99.39	0.002043	0.03178	101.9
01/03/2021	2	8673	250	4.3	11:47:40	11:47:40	micro_2021-03-01_f0000.txt	aCO2	5.01	5.39	21.84	0	1019	3.78	99.39	0.002043	0.03178	101.9
01/03/2021	2	8673	400	4.3	11:59:00	11:59:00	micro_2021-03-01_f0000.txt	aCO2	5.01	5.39	21.84	0	1019	3.78	99.39	0.002043	0.03178	101.9
01/03/2021	2	8668	30	6.4	12:07:38	12:07:38	micro_2021-03-01_f0000.txt	aCO2	5.27	5.4	21.82	0	1018.62	4.27	96.78	0.002043	0.03178	101.862
01/03/2021	2	8668	150	6.4	12:16:40	12:16:40	micro_2021-03-01_f0000.txt	aCO2	5.27	5.4	21.82	0	1018.62	4.27	96.78	0.002043	0.03178	101.862
01/03/2021	2	8668	250	6.4	12:26:30	12:26:30	micro_2021-03-01_f0000.txt	aCO2	5.27	5.4	21.82	0	1018.62	4.27	96.78	0.002043	0.03178	101.862
01/03/2021	2	8668	400	6.4	12:36:54	12:36:54	micro_2021-03-01_f0000.txt	aCO2	5.27	5.4	21.82	0	1018.62	4.27	96.78	0.002043	0.03178	101.862
01/03/2021	2	8749	30	6.3	12:46:27	12:46:27	micro_2021-03-01_f0000.txt	aCO2	5.27	5.4	21.82	0	1018.62	4.27	96.78	0.002043	0.03178	101.862
01/03/2021	2	8749	150	6.2	12:56:00	12:56:00	micro_2021-03-01_f0000.txt	aCO2	5.27	5.4	21.82	0	1018.62	4.27	96.78	0.002043	0.03178	101.862
01/03/2021	2	8749	250	6.1	13:07:40	13:07:40	micro_2021-03-01_f0000.txt	aCO2	5.54	5.46	21.86	0	1018.38	4.33	92.65	0.002043	0.03178	101.838
01/03/2021	2	8749	400	6.1	13:17:40	13:17:40	micro_2021-03-01_f0000.txt	aCO2	5.54	5.46	21.86	0	1018.38	4.33	92.65	0.002043	0.03178	101.838
01/03/2021	4	6574	30	8.5	13:33:28	13:33:28	micro_2021-03-01_f0000.txt	eCO2	5.54	5.14	25.76	0	1018.38	4.33	92.65	0.002043	0.03178	101.838
01/03/2021	4	6574	150	7.7	13:44:00	13:44:00	micro_2021-03-01_f0000.txt	eCO2	5.54	5.14	25.76	0	1018.38	4.33	92.65	0.002043	0.03178	101.838
01/03/2021	4	6574	250	7.7	13:53:50	13:53:50	micro_2021-03-01_f0000.txt	eCO2	5.54	5.14	25.76	0	1018.38	4.33	92.65	0.002043	0.03178	101.838
01/03/2021	4	6574	400	7.6	14:07:22	14:07:22	micro_2021-03-01_f0000.txt	eCO2	5.66	7.07	25.76	0	1017.67	4.32	89.74	0.002043	0.03178	101.767
01/03/2021	4	6518	30	6.5	14:18:10	14:18:10	micro_2021-03-01_f0000.txt	eCO2	5.66	7.07	25.76	0	1017.67	4.32	89.74	0.002043	0.03178	101.767
01/03/2021	4	6518	150	6.3	14:27:45	14:27:45	micro_2021-03-01_f0000.txt	eCO2	5.66	7.07	25.76	0	1017.67	4.32	89.74	0.002043	0.03178	101.767
01/03/2021	4	6518	250	6.5	14:36:50	14:36:50	micro_2021-03-01_f0000.txt	eCO2	5.66	7.07	25.76	0	1017.67	4.32	89.74	0.002043	0.03178	101.767
01/03/2021	4	6518	400	4.7	14:59:00	14:59:00	micro_2021-03-01_f0000.txt	eCO2	5.66	7.07	25.76	0	1017.67	4.32	89.74	0.002043	0.03178	101.767
01/03/2021	4	6516	30	8.4	15:07:30	15:07:30	micro_2021-03-01_f0000.txt	eCO2	5.62	8.32	25.34	0	1017.5	4.12	88.98	0.002043	0.03178	101.75
01/03/2021	4	6516	150	8.5	15:17:00	15:17:00	micro_2021-03-01_f0000.txt	eCO2	5.62	8.32	25.34	0	1017.5	4.12	88.98	0.002043	0.03178	101.75
01/03/2021	4	6516	250	4.3	15:28:40	15:28:40	micro_2021-03-01_f0000.txt	eCO2	5.62	8.32	25.34	0	1017.5	4.12	88.98	0.002043	0.03178	101.75
01/03/2021	4	6516	400	4.3	15:39:00	15:39:00	micro_2021-03-01_f0000.txt	eCO2	5.62	8.32	25.34	0	1017.5	4.12	88.98	0.002043	0.03178	101.75
22/03/2021	4	6574	70	1.1	08:45:27	08:45:27	micro_2021-03-22_f0000.txt	eCO2	5.46	7.58	25.44	0	1012.5	4.2	95.81	0.0042535	0.02835	101.25
22/03/2021	4	6580	70	1.7	08:52:54	08:52:54	micro_2021-03-22_f0000.txt	eCO2	5.46	7.58	25.44	0	1012.5	4.2	95.81	0.0042535	0.02835	101.25
22/03/2021	4	6516	70	2.4	09:00:24	09:00:24	micro_2021-03-22_f0000.txt	eCO2	5.92	7.58	25.45	0	1012.56	5.56	90.74	0.0042535	0.02835	101.256
22/03/2021	4	6518	70	2.7	09:08:00	09:08:00	micro_2021-03-22_f0000.txt	eCO2	5.92	7.58	25.45	0	1012.56	5.56	90.74	0.0042535	0.02835	101.256
22/03/2021	4	6622	70	1.6	09:16:10	09:16:10	micro_2021-03-22_f0000.txt	eCO2	5.92	7.58	25.45	0	1012.56	5.56	90.74	0.0042535	0.02835	101.256
22/03/2021	5	6373	70	3.1	09:25:50	09:25:50	micro_2021-03-22_f0000.txt	aCO2	6.08	6.2	24.81	0	1012.56	5.56	90.74	0.0042535	0.02835	101.256
22/03/2021	5	6387	70	2.4	09:33:10	09:33:10	micro_2021-03-22_f0000.txt	aCO2	6.08	6.2	24.81	0	1012.56	5.56	90.74	0.0042535	0.02835	101.256
22/03/2021	5	6382	70	2	09:40:55	09:40:55	micro_2021-03-22_f0000.txt	aCO2	6.08	6.2	24.81	0	1012.56	5.56	90.74	0.0042535	0.02835	101.256
22/03/2021	5	6406	70	1.7	09:55:29	09:55:29	micro_2021-03-22_f0000.txt	aCO2	6.08	6.2	24.81	0	1012.56	5.56	90.74	0.0042535	0.02835	101.256
22/03/2021	5	6384	70	1.6	10:02:55	10:02:55	micro_2021-03-22_f0000.txt	aCO2	7.14	6.22	24.81	0	1012.59	7.26	81.03	0.0042535	0.02835	101.259
22/03/2021	1	8433	70	7.1	10:13:10	10:13:10	micro_2021-03-22_f0000.txt	eCO2	6.99	6.42	20.65	0	1012.59	7.26	81.03	0.0042535	0.02835	101.259
22/03/2021	1	8445	70	7.4	10:24:36	10:24:36	micro_2021-03-22_f0000.txt	eCO2	6.99	6.42	20.65	0	1012.59	7.26	81.03	0.0042535	0.02835	101.259
22/03/2021	1	8468	70	6.9	10:32:27	10:32:27	micro_2021-03-22_f0000.txt	eCO2	6.99	6.42	20.65	0	1012.59	7.26	81.03	0.0042535	0.02835	101.259
22/03/2021	1	8446	70	7.3	10:40:40	10:40:40	micro_2021-03-22_f0000.txt	eCO2	6.99	6.42	20.65	0	1012.59	7.26	81.03	0.0042535	0.02835	101.259
22/03/2021	1	8437	70	8.3	10:48:55	10:48:55	micro_2021-03-22_f0000.txt	eCO2	6.99	6.42	20.65	0	1012.59	7.26	81.03	0.0042535	0.02835	101.259
22/03/2021	3	8357	70	7.2	11:03:20	11:03:20	micro_2021-03-22_f0001.txt	aCO2	7.34	6.37	20.65	0	1012.5	8.47	75.56	0.0042535	0.02835	101.25
22/03/2021	3	8351	70	6.6	11:11:10	11:11:10	micro_2021-03-22_f0001.txt	aCO2	7.34	6.37	20.65	0	1012.5	8.47	75.56	0.0042535	0.02835	101.25
22/03/2021	3	9301	70	6.8	11:21:00	11:21:00	micro_2021-03-22_f0001.txt	aCO2	7.34	6.37	20.65	0	1012.5	8.47	75.56	0.0042535	0.02835	101.25
22/03/2021	3	8345	70	6.9	11:29:00	11:29:00	micro_2021-03-22_f0001.txt	aCO2	7.34	6.37	20.65	0	1012.5	8.47	75.56	0.0042535	0.02835	101.25
22/03/2021	3	8300	70	6.3	11:37:13	11:37:13	micro_2021-03-22_f0001.txt	aCO2	7.34	6.37	20.65	0	1012.5	8.47	75.56	0.0042535	0.02835	101.25
22/03/2021	2	8668	70	7.7	11:46:45	11:46:45	micro_2021-03-22_f0001.txt	aCO2	7.48	6.46	23.17	0	1012.5	8.47	75.56	0.0042535	0.02835	101.25
22/03/2021	2	8749	70	7.7	11:54:05	11:54:05	micro_2021-03-22_f0001.txt	aCO2	7.48	6.46	23.17	0	1012.5	8.47	75.56	0.0042535	0.02835	101.25
22/03/2021	2	8673	70	7.3	12:02:08	12:02:08	micro_2021-03-22_f0001.txt	aCO2	7.93	6.53	23.18	0	1012.56	9.63	71.22	0.0042535	0.02835	101.256
22/03/2021	2	6876	70	7.1	12:11:30	12:11:30	micro_2021-03-22_f0001.txt	aCO2	7.93	6.53	23.18	0	1012.56	9.63	71.22	0.0042535	0.02835	101.256
22/03/2021	2	6889	70	7.2	12:19:45	12:19:45	micro_2021-03-22_f0001.txt	aCO2	7.93	6.53	23.18	0	1012.56	9.63	71.22	0.0042535	0.02835	101.256
22/03/2021	6	5846	70	9.6	12:31:30	12:31:30	micro_2021-03-22_f0001.txt	eCO2	7.64	6.66	16.44	0	1012.56	9.63	71.22	0.0042535	0.02835	101.256
22/03/2021	6	5844	70	9.3	12:38:50	12:38:50	micro_2021-03-22_f0001.txt	eCO2	7.64	6.66	16.44	0	1012.56	9.63	71.22	0.0042535	0.02835	101.256
22/03/2021	6	5850	70	8.9	12:46:50	12:46:50	micro_2021-03-22_f0001.txt	eCO2	7.64	6.66	16.44	0	1012.56	9.63	71.22	0.0042535	0.02835	101.256
22/03/2021	6	3750	70	9.5	12:54:25	12:54:25	micro_2021-03-22_f0001.txt	eCO2	7.64	6.66	16.44	0	1012.56	9.63	71.22	0.0042535	0.02835	101.256
22/03/2021	6	3752	70	8.9	13:01:30	13:01:30	micro_2021-03-22_f0001.txt	eCO2	8.16	6.77	16.41	0	1012.03	10.45	67.27	0.0042535	0.02835	101.203
15/04/2021	3	8357	70	1.6	07:52:37	08:45:37	micro_2021-04-15_f0000.txt	aCO2	3.44	5.95	16.74	0	1021	2.29	89.72	0.0042535	0.02835	102.1
15/04/2021	3	8351	70	2	08:00:40	08:53:40	micro_2021-04-15_f0000.txt	aCO2	3.44	5.95	16.74	0	1021	2.29	89.72	0.0042535	0.02835	102.1
15/04/2021	3	8300	70	1.7	08:10:37	09:03:37	micro_2021-04-15_f0000.txt	aCO2	4.3	5.89	16.74	0	1020.96	5.47	75.89	0.0042535	0.02835	102.096
15/04/2021	3	8345	70	1.8	08:18:30	09:11:30	micro_2021-04-15_f0000.txt	aCO2	4.3	5.89	16.74	0	1020.96	5.47	75.89	0.0042535	0.02835	102.096
15/04/2021	3	9301	70	1.2	08:26:40	09:19:40	micro_2021-04-15_f0000.txt	aCO2	4.3	5.89	16.74	0	1020.96	5.47	75.89	0.0042535	0.02835	102.096
15/04/2021	1	8433	70	3.4	08:36:05	09:29:05	micro_2021-04-15_f0000.txt	eCO2	3.98	5.91	19.01	0	1020.96	5.47	75.89	0.0042535	0.02835	102.096
15/04/2021	1	8437	70	3	08:44:10	09:37:10	micro_2021-04-15_f0000.txt	eCO2	3.98	5.91	19.01	0	1020.96	5.47	75.89	0.0042535	0.02835	102.096
15/04/2021	1	8445	70	3.1	08:51:40	09:44:40	micro_2021-04-15_f0000.txt	eCO2	3.98	5.91	19.01	0	1020.96	5.47	75.89	0.0042535	0.02835	102.096
15/04/2021	1	8446	70	3.3	08:59:20	09:52:20	micro_2021-04-15_f0000.txt	eCO2	3.98	5.91	19.01	0	1020.96	5.47	75.89	0.0042535	0.02835	102.096
15/04/2021	1	8468	70	3.4	09:07:10	10:00:10	micro_2021-04-15_f0000.txt	eCO2	5.29	5.88	18.99	0	1021	6.95	63.53	0.0042535	0.02835	102.1
15/04/2021	6	5846	70	6.1	09:19:20	10:12:20	micro_2021-04-15_f0000.txt	eCO2	5.24	5.88	12.77	0	1021	6.95	63.53	0.0042535	0.02835	102.1
15/04/2021	6	5844	70	6.7	09:26:30	10:19:30	micro_2021-04-15_f0000.txt	eCO2	5.24	5.88	12.77	0	1021	6.95	63.53	0.0042535	0.02835	102.1
15/04/2021	6	3752	70	8.4	09:34:42	10:27:42	micro_2021-04-15_f0000.txt	eCO2	5.24	5.88	12.77	0	1021	6.95	63.53	0.0042535	0.02835	102.1
15/04/2021	6	3750	70	5.7	09:42:55	10:35:55	micro_2021-04-15_f0000.txt	eCO2	5.24	5.88	12.77	0	1021	6.95	63.53	0.0042535	0.02835	102.1
15/04/2021	6	5850	70	5	09:50:45	10:43:45	micro_2021-04-15_f0000.txt	eCO2	5.24	5.88	12.77	0	1021	6.95	63.53	0.0042535	0.02835	102.1
15/04/2021	5	6387	70	5.9	10:01:24	10:54:24	micro_2021-04-15_f0000.txt	aCO2	5.9	5.68	20.78	0	1021	6.95	63.53	0.0042535	0.02835	102.1
15/04/2021	5	6384	70	5.5	10:10:32	11:03:32	micro_2021-04-15_f0000.txt	aCO2	7.18	5.7	20.78	0	1020.91	7.91	55.98	0.0042535	0.02835	102.091
15/04/2021	5	6382	70	5.9	10:25:05	11:18:05	micro_2021-04-15_f0001.txt	aCO2	7.18	5.7	20.78	0	1020.91	7.91	55.98	0.0042535	0.02835	102.091
15/04/2021	5	6406	70	7.6	10:33:15	11:26:15	micro_2021-04-15_f0001.txt	aCO2	7.18	5.7	20.78	0	1020.91	7.91	55.98	0.0042535	0.02835	102.091
15/04/2021	5	6373	70	6.7	10:41:10	11:34:10	micro_2021-04-15_f0001.txt	aCO2	7.18	5.7	20.78	0	1020.91	7.91	55.98	0.0042535	0.02835	102.091
15/04/2021	2	8689	70	15.7	10:56:45	11:49:45	micro_2021-04-15_f0001.txt	aCO2	6.9	6.12	23.9	0	1020.91	7.91	55.98	0.0042535	0.02835	102.091
15/04/2021	2	8676	70	8	11:04:30	11:57:30	micro_2021-04-15_f0001.txt	aCO2	6.9	6.12	23.9	0	1020.91	7.91	55.98	0.0042535	0.02835	102.091
15/04/2021	2	8673	70	8.8	11:12:12	12:05:12	micro_2021-04-15_f0001.txt	aCO2	8.86	6.17	23.87	0	1020.47	8.96	51.94	0.0042535	0.02835	102.047
15/04/2021	2	8668	70	8.6	11:19:45	12:12:45	micro_2021-04-15_f0001.txt	aCO2	8.86	6.17	23.87	0	1020.47	8.96	51.94	0.0042535	0.02835	102.047
15/04/2021	2	8749	70	8.5	11:27:15	12:20:15	micro_2021-04-15_f0001.txt	aCO2	8.86	6.17	23.87	0	1020.47	8.96	51.94	0.0042535	0.02835	102.047
15/04/2021	4	6574	70	8.5	11:59:10	12:52:10	micro_2021-04-15_f0001.txt	eCO2	8.02	5.81	22.8	0	1020.47	8.96	51.94	0.0042535	0.02835	102.047
15/04/2021	4	6518	70	6.4	12:07:05	13:00:05	micro_2021-04-15_f0001.txt	eCO2	8.98	5.96	22.84	0	1019.86	9.94	45.41	0.0042535	0.02835	101.986
15/04/2021	4	6516	70	11	12:15:40	13:08:40	micro_2021-04-15_f0001.txt	eCO2	8.98	5.96	22.84	0	1019.86	9.94	45.41	0.0042535	0.02835	101.986
15/04/2021	4	6622	70	8.5	12:24:45	13:17:45	micro_2021-04-15_f0001.txt	eCO2	8.98	5.96	22.84	0	1019.86	9.94	45.41	0.0042535	0.02835	101.986
15/04/2021	4	6580	70	7.8	11:44:45	12:37:45	micro_2021-04-15_f0001.txt	eCO2	8.02	5.81	22.8	0	1020.47	8.96	51.94	0.0042535	0.02835	102.047
04/05/2021	1	8445	30	5.9	08:14:25	09:06:18	micro_2021-05-04_f0000.txt	eCO2	6.95	7.21	21.81	0	983.29	7.29	83.68	0.002043	0.03178	98.329
04/05/2021	1	8445	70	5.3	10:29:41	11:21:34	micro_2021-05-04_f0020.txt	eCO2	7.56	7.24	21.76	0	985.67	7.53	86.21	0.0042535	0.02835	98.567
04/05/2021	1	8445	150	5.3	08:24:00	09:15:53	micro_2021-05-04_f0000.txt	eCO2	6.95	7.21	21.81	0	983.29	7.29	83.68	0.002043	0.03178	98.329
04/05/2021	1	8445	250	6	08:33:34	09:25:27	micro_2021-05-04_f0000.txt	eCO2	6.95	7.21	21.81	0	983.29	7.29	83.68	0.002043	0.03178	98.329
04/05/2021	1	8445	400	5.6	08:41:52	09:33:45	micro_2021-05-04_f0000.txt	eCO2	6.95	7.21	21.81	0	983.29	7.29	83.68	0.002043	0.03178	98.329
04/05/2021	1	8437	30	5.6	08:51:30	09:43:23	micro_2021-05-04_f0000.txt	eCO2	6.95	7.21	21.81	0	983.29	7.29	83.68	0.002043	0.03178	98.329
04/05/2021	1	8437	70	5.6	10:41:35	11:33:28	micro_2021-05-04_f0020.txt	eCO2	7.56	7.24	21.76	0	985.67	7.53	86.21	0.0042535	0.02835	98.567
04/05/2021	1	8437	150	5.5	09:01:39	09:53:32	micro_2021-05-04_f0000.txt	eCO2	6.95	7.21	21.81	0	983.29	7.29	83.68	0.002043	0.03178	98.329
04/05/2021	1	8437	250	5.5	09:10:40	10:02:33	micro_2021-05-04_f0000.txt	eCO2	7.44	7.21	21.8	0.05	984.71	7.27	84.58	0.002043	0.03178	98.471
04/05/2021	1	8437	400	5.7	09:31:26	10:23:19	micro_2021-05-04_f0000.txt	eCO2	7.44	7.21	21.8	0.05	984.71	7.27	84.58	0.002043	0.03178	98.471
04/05/2021	1	8446	30	5.7	09:41:00	10:32:53	micro_2021-05-04_f0000.txt	eCO2	7.44	7.21	21.8	0.05	984.71	7.27	84.58	0.002043	0.03178	98.471
04/05/2021	1	8446	70	5.3	10:51:20	11:43:13	micro_2021-05-04_f0020.txt	eCO2	7.56	7.24	21.76	0	985.67	7.53	86.21	0.0042535	0.02835	98.567
04/05/2021	1	8446	150	5.6	09:56:37	10:48:30	micro_2021-05-04_f0000.txt	eCO2	7.44	7.21	21.8	0.05	984.71	7.27	84.58	0.002043	0.03178	98.471
04/05/2021	1	8446	250	5.1	10:06:19	10:58:12	micro_2021-05-04_f0000.txt	eCO2	7.44	7.21	21.8	0.05	984.71	7.27	84.58	0.002043	0.03178	98.471
04/05/2021	1	8446	400	5.4	10:15:12	11:07:05	micro_2021-05-04_f0000.txt	eCO2	7.56	7.24	21.76	0	985.67	7.53	86.21	0.002043	0.03178	98.567
04/05/2021	3	8357	30	5.7	11:17:00	12:08:53	micro_2021-05-04_f0000.txt	aCO2	7.54	7.25	20.74	0.7	986.62	7.07	88.53	0.002043	0.03178	98.662
04/05/2021	3	8357	70	5.1	13:49:40	14:41:33	micro_2021-05-04_f0021.txt	aCO2	7.84	7.33	22.46	0.1	988.33	7.19	88.6	0.0042535	0.02835	98.833
04/05/2021	3	8357	150	5.1	11:25:34	12:17:27	micro_2021-05-04_f0000.txt	aCO2	7.54	7.25	20.74	0.7	986.62	7.07	88.53	0.002043	0.03178	98.662
04/05/2021	3	8357	250	5.1	11:34:00	12:25:53	micro_2021-05-04_f0000.txt	aCO2	7.54	7.25	20.74	0.7	986.62	7.07	88.53	0.002043	0.03178	98.662
04/05/2021	3	8357	400	4.8	11:42:05	12:33:58	micro_2021-05-04_f0000.txt	aCO2	7.54	7.25	20.74	0.7	986.62	7.07	88.53	0.002043	0.03178	98.662
04/05/2021	3	8351	30	4.9	11:57:10	12:49:03	micro_2021-05-04_f0000.txt	aCO2	7.54	7.25	20.74	0.7	986.62	7.07	88.53	0.002043	0.03178	98.662
04/05/2021	3	8351	70	4.9	13:58:45	14:50:38	micro_2021-05-04_f0021.txt	aCO2	7.84	7.33	22.46	0.1	988.33	7.19	88.6	0.0042535	0.02835	98.833
04/05/2021	3	8351	150	4.8	12:09:50	13:01:43	micro_2021-05-04_f0000.txt	aCO2	7.54	7.29	21.66	0.25	987.67	7.06	91.51	0.002043	0.03178	98.767
04/05/2021	3	8351	250	4.7	12:18:05	13:09:58	micro_2021-05-04_f0000.txt	aCO2	7.54	7.29	21.66	0.25	987.67	7.06	91.51	0.002043	0.03178	98.767
04/05/2021	3	8351	400	4.7	12:26:19	13:18:12	micro_2021-05-04_f0000.txt	aCO2	7.54	7.29	21.66	0.25	987.67	7.06	91.51	0.002043	0.03178	98.767
04/05/2021	3	9301	30	5.4	12:37:31	13:29:24	micro_2021-05-04_f0000.txt	aCO2	7.54	7.29	21.66	0.25	987.67	7.06	91.51	0.002043	0.03178	98.767
04/05/2021	3	9301	70	5.2	14:09:35	15:01:28	micro_2021-05-04_f0021.txt	aCO2	8.12	7.39	22.66	0	988.96	7.64	86.38	0.0042535	0.02835	98.896
04/05/2021	3	9301	150	5.3	12:47:25	13:39:18	micro_2021-05-04_f0000.txt	aCO2	7.54	7.29	21.66	0.25	987.67	7.06	91.51	0.002043	0.03178	98.767
04/05/2021	3	9301	250	5.3	13:01:25	13:53:18	micro_2021-05-04_f0000.txt	aCO2	7.54	7.29	21.66	0.25	987.67	7.06	91.51	0.002043	0.03178	98.767
04/05/2021	3	9301	400	5.2	13:10:30	14:02:23	micro_2021-05-04_f0000.txt	aCO2	7.84	7.33	22.46	0.1	988.33	7.19	88.6	0.002043	0.03178	98.833
04/05/2021	5	6387	30	5.8	13:40:00	14:31:53	micro_2021-05-04_f0000.txt	aCO2	7.34	7.14	23.04	0.1	988.33	7.19	88.6	0.002043	0.03178	98.833
04/05/2021	5	6387	70	5.9	15:01:00	15:52:53	micro_2021-05-04_f0022.txt	aCO2	7.52	7.17	23.08	0	988.96	7.64	86.38	0.0042535	0.02835	98.896
04/05/2021	5	6387	150	5.8	13:53:10	14:45:03	micro_2021-05-04_f0000.txt	aCO2	7.34	7.14	23.04	0.1	988.33	7.19	88.6	0.002043	0.03178	98.833
04/05/2021	5	6387	250	5.8	14:01:30	14:53:23	micro_2021-05-04_f0000.txt	aCO2	7.34	7.14	23.04	0.1	988.33	7.19	88.6	0.002043	0.03178	98.833
04/05/2021	5	6387	400	5.5	14:14:00	15:05:53	micro_2021-05-04_f0000.txt	aCO2	7.52	7.17	23.08	0	988.96	7.64	86.38	0.002043	0.03178	98.896
04/05/2021	5	6373	30	6.1	14:24:10	15:16:03	micro_2021-05-04_f0000.txt	aCO2	7.52	7.17	23.08	0	988.96	7.64	86.38	0.002043	0.03178	98.896
04/05/2021	5	6373	70	6	15:09:30	16:01:23	micro_2021-05-04_f0022.txt	aCO2	7.41	7.22	23.06	0.08	989.17	7.21	85.77	0.0042535	0.02835	98.917
04/05/2021	5	6373	150	6.4	14:33:00	15:24:53	micro_2021-05-04_f0000.txt	aCO2	7.52	7.17	23.08	0	988.96	7.64	86.38	0.002043	0.03178	98.896
04/05/2021	5	6373	250	5.1	14:54:00	15:45:53	micro_2021-05-04_f0000.txt	aCO2	7.52	7.17	23.08	0	988.96	7.64	86.38	0.002043	0.03178	98.896
04/05/2021	5	6373	400	6.4	15:01:30	15:53:23	micro_2021-05-04_f0000.txt	aCO2	7.52	7.17	23.08	0	988.96	7.64	86.38	0.002043	0.03178	98.896
05/05/2021	5	6382	30	4.8	08:06:42	08:58:35	micro_2021-05-05_f0000.txt	aCO2	5.77	6.61	22.59	0	994.21	5.22	90.8	0.002043	0.03178	99.421
05/05/2021	5	6382	70	5.2	08:15:14	09:07:07	micro_2021-05-05_f0000.txt	aCO2	6.39	6.6	22.58	0	994.42	6.96	82.86	0.0042535	0.02835	99.442
05/05/2021	5	6382	150	5.1	08:24:44	09:16:37	micro_2021-05-05_f0000.txt	aCO2	6.39	6.6	22.58	0	994.42	6.96	82.86	0.002043	0.03178	99.442
05/05/2021	5	6382	250	4.9	08:36:13	09:28:06	micro_2021-05-05_f0000.txt	aCO2	6.39	6.6	22.58	0	994.42	6.96	82.86	0.002043	0.03178	99.442
05/05/2021	5	6382	400	4.7	08:44:15	09:36:08	micro_2021-05-05_f0000.txt	aCO2	6.39	6.6	22.58	0	994.42	6.96	82.86	0.002043	0.03178	99.442
05/05/2021	2	8673	30	4.3	08:55:01	09:46:54	micro_2021-05-05_f0000.txt	aCO2	6.39	6.6	22.58	0	994.42	6.96	82.86	0.002043	0.03178	99.442
05/05/2021	2	8673	70	4.5	11:21:30	12:13:23	micro_2021-05-05_f0020.txt	aCO2	6.39	6.6	22.58	0	995.79	6.88	76.25	0.0042535	0.02835	99.579
05/05/2021	2	8673	150	4.9	09:04:50	09:56:43	micro_2021-05-05_f0000.txt	aCO2	6.39	6.6	22.58	0	994.42	6.96	82.86	0.002043	0.03178	99.442
05/05/2021	2	8673	250	4.8	09:15:43	10:07:36	micro_2021-05-05_f0000.txt	aCO2	6.39	6.6	22.58	0	994.92	6.69	80.81	0.002043	0.03178	99.492
05/05/2021	2	8673	400	4.8	09:27:08	10:19:01	micro_2021-05-05_f0000.txt	aCO2	6.39	6.6	22.58	0	994.92	6.69	80.81	0.002043	0.03178	99.492
05/05/2021	2	8668	30	6.5	09:53:27	10:45:20	micro_2021-05-05_f0000.txt	aCO2	6.39	6.6	22.58	0	994.92	6.69	80.81	0.002043	0.03178	99.492
05/05/2021	2	8668	70	6.4	11:55:08	12:47:01	micro_2021-05-05_f0021.txt	aCO2	6.39	6.6	22.58	0	995.79	6.88	76.25	0.0042535	0.02835	99.579
05/05/2021	2	8668	150	6.4	09:45:50	10:37:43	micro_2021-05-05_f0000.txt	aCO2	6.39	6.6	22.58	0	994.92	6.69	80.81	0.002043	0.03178	99.492
05/05/2021	2	8668	250	6.6	10:03:28	10:55:21	micro_2021-05-05_f0000.txt	aCO2	6.39	6.6	22.58	0	994.92	6.69	80.81	0.002043	0.03178	99.492
05/05/2021	2	8668	400	6.5	10:15:00	11:06:53	micro_2021-05-05_f0000.txt	aCO2	6.39	6.6	22.58	0	995.38	8.12	73.27	0.002043	0.03178	99.538
05/05/2021	2	8749	30	6.4	10:30:30	11:22:23	micro_2021-05-05_f0000.txt	aCO2	6.39	6.6	22.58	0	995.38	8.12	73.27	0.002043	0.03178	99.538
05/05/2021	2	8749	70	6.2	12:07:12	12:59:05	micro_2021-05-05_f0021.txt	aCO2	6.39	6.6	22.58	0	995.79	6.88	76.25	0.0042535	0.02835	99.579
05/05/2021	2	8749	150	5.9	10:38:15	11:30:08	micro_2021-05-05_f0000.txt	aCO2	6.39	6.6	22.58	0	995.38	8.12	73.27	0.002043	0.03178	99.538
05/05/2021	2	8749	250	5.9	10:48:01	11:39:54	micro_2021-05-05_f0000.txt	aCO2	6.39	6.6	22.58	0	995.38	8.12	73.27	0.002043	0.03178	99.538
05/05/2021	2	8749	400	5.9	10:59:28	11:51:21	micro_2021-05-05_f0000.txt	aCO2	6.39	6.6	22.58	0	995.38	8.12	73.27	0.002043	0.03178	99.538
05/05/2021	4	6574	30	4.4	11:14:35	12:06:28	micro_2021-05-05_f0000.txt	eCO2	7.35	6.72	24.59	0	995.79	6.88	76.25	0.002043	0.03178	99.579
05/05/2021	4	6574	70	4.4	13:44:45	14:36:38	micro_2021-05-05_f0022.txt	eCO2	6.81	6.85	24.59	0.92	996.04	4.64	90.59	0.0042535	0.02835	99.604
05/05/2021	4	6574	150	4.5	11:25:18	12:17:11	micro_2021-05-05_f0000.txt	eCO2	7.35	6.72	24.59	0	995.79	6.88	76.25	0.002043	0.03178	99.579
05/05/2021	4	6574	250	4.5	11:37:40	12:29:33	micro_2021-05-05_f0000.txt	eCO2	7.35	6.72	24.59	0	995.79	6.88	76.25	0.002043	0.03178	99.579
05/05/2021	4	6574	400	5.1	11:49:40	12:41:33	micro_2021-05-05_f0000.txt	eCO2	7.35	6.72	24.59	0	995.79	6.88	76.25	0.002043	0.03178	99.579
05/05/2021	4	6518	30	3.3	12:19:03	13:10:56	micro_2021-05-05_f0000.txt	eCO2	7.06	6.78	24.66	0.38	996.08	6.84	75.86	0.002043	0.03178	99.608
05/05/2021	4	6518	70	3.5	13:57:00	14:48:53	micro_2021-05-05_f0022.txt	eCO2	6.81	6.85	24.59	0.92	996.04	4.64	90.59	0.0042535	0.02835	99.604
05/05/2021	4	6518	150	3.5	12:30:05	13:21:58	micro_2021-05-05_f0000.txt	eCO2	7.06	6.78	24.66	0.38	996.08	6.84	75.86	0.002043	0.03178	99.608
05/05/2021	4	6518	250	3.6	12:37:45	13:29:38	micro_2021-05-05_f0000.txt	eCO2	7.06	6.78	24.66	0.38	996.08	6.84	75.86	0.002043	0.03178	99.608
05/05/2021	4	6518	400	3.4	12:48:30	13:40:23	micro_2021-05-05_f0000.txt	eCO2	7.06	6.78	24.66	0.38	996.08	6.84	75.86	0.002043	0.03178	99.608
06/05/2021	4	6516	30	3.3	08:29:44	09:21:37	micro_2021-05-06_f0000.txt	eCO2	5.72	6.34	25.83	0	992.29	4.72	88.79	0.002043	0.03178	99.229
06/05/2021	4	6516	70	3.2	08:45:16	09:37:09	micro_2021-05-06_f0000.txt	eCO2	5.72	6.34	25.83	0	992.29	4.72	88.79	0.0042535	0.02835	99.229
06/05/2021	4	6516	150	3.2	08:37:30	09:29:23	micro_2021-05-06_f0000.txt	eCO2	5.72	6.34	25.83	0	992.29	4.72	88.79	0.002043	0.03178	99.229
06/05/2021	4	6516	250	3.3	08:53:28	09:45:21	micro_2021-05-06_f0000.txt	eCO2	5.72	6.34	25.83	0	992.29	4.72	88.79	0.002043	0.03178	99.229
06/05/2021	4	6516	400	3.4	09:00:05	09:51:58	micro_2021-05-06_f0000.txt	eCO2	5.72	6.34	25.83	0	992.29	4.72	88.79	0.002043	0.03178	99.229
06/05/2021	6	5846	30	4.5	09:23:00	10:14:53	micro_2021-05-06_f0000.txt	eCO2	6.6	6.67	17.07	0	992.58	6.47	76.76	0.002043	0.03178	99.258
06/05/2021	6	5846	70	4.6	09:31:27	10:23:20	micro_2021-05-06_f0000.txt	eCO2	6.6	6.67	17.07	0	992.58	6.47	76.76	0.0042535	0.02835	99.258
06/05/2021	6	5846	150	5.1	09:40:23	10:32:16	micro_2021-05-06_f0000.txt	eCO2	6.6	6.67	17.07	0	992.58	6.47	76.76	0.002043	0.03178	99.258
06/05/2021	6	5846	250	4.7	09:48:20	10:40:13	micro_2021-05-06_f0000.txt	eCO2	6.6	6.67	17.07	0	992.58	6.47	76.76	0.002043	0.03178	99.258
06/05/2021	6	5846	400	4.7	10:03:22	10:55:15	micro_2021-05-06_f0000.txt	eCO2	6.6	6.67	17.07	0	992.58	6.47	76.76	0.002043	0.03178	99.258
06/05/2021	6	3752	30	5	10:15:03	11:06:56	micro_2021-05-06_f0000.txt	eCO2	7.22	6.7	17.08	0	992.46	7.81	65.54	0.002043	0.03178	99.246
06/05/2021	6	3752	70	5.1	10:29:13	11:21:06	micro_2021-05-06_f0000.txt	eCO2	7.22	6.7	17.08	0	992.46	7.81	65.54	0.0042535	0.02835	99.246
06/05/2021	6	3752	150	4.4	10:21:40	11:13:33	micro_2021-05-06_f0000.txt	eCO2	7.22	6.7	17.08	0	992.46	7.81	65.54	0.002043	0.03178	99.246
06/05/2021	6	3752	250	4	10:45:33	11:37:26	micro_2021-05-06_f0000.txt	eCO2	7.22	6.7	17.08	0	992.46	7.81	65.54	0.002043	0.03178	99.246
06/05/2021	6	3752	400	4.9	10:54:10	11:46:03	micro_2021-05-06_f0000.txt	eCO2	7.22	6.7	17.08	0	992.46	7.81	65.54	0.002043	0.03178	99.246
06/05/2021	6	5850	30	7.8	11:02:20	11:54:13	micro_2021-05-06_f0000.txt	eCO2	7.22	6.7	17.08	0	992.46	7.81	65.54	0.002043	0.03178	99.246
06/05/2021	6	5850	70	7.5	11:15:13	12:07:06	micro_2021-05-06_f0000.txt	eCO2	7.54	6.77	16.99	0	992.33	8.78	61.42	0.0042535	0.02835	99.233
06/05/2021	6	5850	150	7.5	11:33:02	12:24:55	micro_2021-05-06_f0000.txt	eCO2	7.54	6.77	16.99	0	992.33	8.78	61.42	0.002043	0.03178	99.233
06/05/2021	6	5850	250	7.8	11:52:43	12:44:36	micro_2021-05-06_f0000.txt	eCO2	7.54	6.77	16.99	0	992.33	8.78	61.42	0.002043	0.03178	99.233
06/05/2021	6	5850	400	7.8	11:44:42	12:36:35	micro_2021-05-06_f0000.txt	eCO2	7.54	6.77	16.99	0	992.33	8.78	61.42	0.002043	0.03178	99.233
19/05/2021	2	8689	70	7.1	07:55:39	08:46:39	micro_2021-05-19_f0000.txt	aCO2	7.72	8.67	27.42	0	1002.92	8.26	98.39	0.0042535	0.02835	100.292
19/05/2021	2	8676	70	7	08:05:23	08:56:23	micro_2021-05-19_f0000.txt	aCO2	7.72	8.67	27.42	0	1002.92	8.26	98.39	0.0042535	0.02835	100.292
19/05/2021	2	8673	70	6.6	08:13:10	09:04:10	micro_2021-05-19_f0000.txt	aCO2	8.43	8.6	27.4	0	1003.29	10.26	90.12	0.0042535	0.02835	100.329
19/05/2021	2	8668	70	6.7	08:21:05	09:12:05	micro_2021-05-19_f0000.txt	aCO2	8.43	8.6	27.4	0	1003.29	10.26	90.12	0.0042535	0.02835	100.329
19/05/2021	2	8749	70	6.6	08:29:40	09:20:40	micro_2021-05-19_f0000.txt	aCO2	8.43	8.6	27.4	0	1003.29	10.26	90.12	0.0042535	0.02835	100.329
19/05/2021	1	8433	70	9.1	08:39:53	09:30:53	micro_2021-05-19_f0000.txt	eCO2	8.43	8.6	27.4	0	1003.29	10.26	90.12	0.0042535	0.02835	100.329
19/05/2021	1	8437	70	9.3	08:49:12	09:40:12	micro_2021-05-19_f0000.txt	eCO2	8.43	8.6	27.4	0	1003.29	10.26	90.12	0.0042535	0.02835	100.329
19/05/2021	1	8445	70	9.2	08:57:58	09:48:58	micro_2021-05-19_f0000.txt	eCO2	8.43	8.6	27.4	0	1003.29	10.26	90.12	0.0042535	0.02835	100.329
19/05/2021	1	8468	70	9.2	09:14:45	10:05:45	micro_2021-05-19_f0000.txt	eCO2	8.43	8.6	27.4	0	1003.42	12.5	75.42	0.0042535	0.02835	100.342
19/05/2021	1	8446	70	9.6	09:06:50	09:57:50	micro_2021-05-19_f0000.txt	eCO2	8.43	8.6	27.4	0	1003.29	10.26	90.12	0.0042535	0.02835	100.329
19/05/2021	3	8357	70	10	09:23:16	10:14:16	micro_2021-05-19_f0000.txt	aCO2	8.94	8.54	21.09	0	1003.42	12.5	75.42	0.0042535	0.02835	100.342
19/05/2021	3	8351	70	9.7	09:30:49	10:21:49	micro_2021-05-19_f0000.txt	aCO2	8.94	8.54	21.09	0	1003.42	12.5	75.42	0.0042535	0.02835	100.342
19/05/2021	3	8345	70	10	09:38:18	10:29:18	micro_2021-05-19_f0000.txt	aCO2	8.94	8.54	21.09	0	1003.42	12.5	75.42	0.0042535	0.02835	100.342
19/05/2021	3	8300	70	9.6	09:46:39	10:37:39	micro_2021-05-19_f0000.txt	aCO2	8.94	8.54	21.09	0	1003.42	12.5	75.42	0.0042535	0.02835	100.342
19/05/2021	3	9301	70	9.6	09:54:00	10:45:00	micro_2021-05-19_f0000.txt	aCO2	8.94	8.54	21.09	0	1003.42	12.5	75.42	0.0042535	0.02835	100.342
19/05/2021	5	6373	70	11.2	10:11:55	11:02:55	micro_2021-05-19_f0001.txt	aCO2	9.57	8.45	22.67	0	1004.08	13.16	69.98	0.0042535	0.02835	100.408
19/05/2021	5	6387	70	10	10:19:50	11:10:50	micro_2021-05-19_f0001.txt	aCO2	9.57	8.45	22.67	0	1004.08	13.16	69.98	0.0042535	0.02835	100.408
19/05/2021	5	6384	70	10.2	10:28:10	11:19:10	micro_2021-05-19_f0001.txt	aCO2	9.57	8.45	22.67	0	1004.08	13.16	69.98	0.0042535	0.02835	100.408
19/05/2021	5	6382	70	10.4	10:36:12	11:27:12	micro_2021-05-19_f0001.txt	aCO2	9.57	8.45	22.67	0	1004.08	13.16	69.98	0.0042535	0.02835	100.408
19/05/2021	5	6406	70	10.3	10:44:00	11:35:00	micro_2021-05-19_f0001.txt	aCO2	9.57	8.45	22.67	0	1004.08	13.16	69.98	0.0042535	0.02835	100.408
19/05/2021	6	5846	70	12.2	10:54:40	11:45:40	micro_2021-05-19_f0001.txt	eCO2	9.96	8.74	15.2	0	1004.08	13.16	69.98	0.0042535	0.02835	100.408
19/05/2021	6	5844	70	16	11:03:15	11:54:15	micro_2021-05-19_f0001.txt	eCO2	9.96	8.74	15.2	0	1004.08	13.16	69.98	0.0042535	0.02835	100.408
19/05/2021	6	3752	70	11	11:11:21	12:02:21	micro_2021-05-19_f0001.txt	eCO2	10.59	8.82	15.18	0	1003.83	14.36	62.46	0.0042535	0.02835	100.383
19/05/2021	6	3750	70	11.5	11:20:05	12:11:05	micro_2021-05-19_f0001.txt	eCO2	10.59	8.82	15.18	0	1003.83	14.36	62.46	0.0042535	0.02835	100.383
19/05/2021	6	5850	70	11.7	11:28:40	12:19:40	micro_2021-05-19_f0001.txt	eCO2	10.59	8.82	15.18	0	1003.83	14.36	62.46	0.0042535	0.02835	100.383
19/05/2021	4	6574	70	9.2	11:40:30	12:31:30	micro_2021-05-19_f0001.txt	eCO2	9.91	8.46	24.13	0	1003.83	14.36	62.46	0.0042535	0.02835	100.383
19/05/2021	4	6580	70	9.2	11:48:00	12:39:00	micro_2021-05-19_f0001.txt	eCO2	9.91	8.46	24.13	0	1003.83	14.36	62.46	0.0042535	0.02835	100.383
19/05/2021	4	6518	70	9.4	11:56:19	12:47:19	micro_2021-05-19_f0001.txt	eCO2	9.91	8.46	24.13	0	1003.83	14.36	62.46	0.0042535	0.02835	100.383
19/05/2021	4	6516	70	9.6	12:04:55	12:55:55	micro_2021-05-19_f0001.txt	eCO2	9.91	8.46	24.13	0	1003.83	14.36	62.46	0.0042535	0.02835	100.383
19/05/2021	4	6622	70	8.5	12:14:30	13:05:30	micro_2021-05-19_f0001.txt	eCO2	9.86	8.54	24.11	0.52	1004.58	9.41	84.19	0.0042535	0.02835	100.458
25/06/2021	6	5846	70	11.9	09:00:30	09:50:30	micro_2021-06-25_f0000.txt	eCO2	12.06	12.18	7.6	0	1003	11.7	95.61	0.0042535	0.02835	100.3
25/06/2021	6	5844	70	12	09:10:10	10:00:10	micro_2021-06-25_f0000.txt	eCO2	12.18	12.14	7.62	0	1002.96	12.68	90.89	0.0042535	0.02835	100.296
25/06/2021	6	3752	70	11.9	09:18:50	10:08:50	micro_2021-06-25_f0000.txt	eCO2	12.18	12.14	7.62	0	1002.96	12.68	90.89	0.0042535	0.02835	100.296
25/06/2021	6	3750	70	11.8	09:27:00	10:17:00	micro_2021-06-25_f0000.txt	eCO2	12.18	12.14	7.62	0	1002.96	12.68	90.89	0.0042535	0.02835	100.296
25/06/2021	6	5850	70	12.2	11:59:30	12:49:30	micro_2021-06-25_f0001.txt	eCO2	12.55	12.09	7.62	0	1002.5	13.84	85.01	0.0042535	0.02835	100.25
25/06/2021	5	6387	70	12	12:13:00	13:03:00	micro_2021-06-25_f0001.txt	aCO2	12.41	11.86	12.04	0	1002.81	13.85	84.74	0.0042535	0.02835	100.281
25/06/2021	5	6384	70	12.2	12:20:30	13:10:30	micro_2021-06-25_f0001.txt	aCO2	12.41	11.86	12.04	0	1002.81	13.85	84.74	0.0042535	0.02835	100.281
25/06/2021	5	6382	70	12.3	12:27:30	13:17:30	micro_2021-06-25_f0001.txt	aCO2	12.41	11.86	12.04	0	1002.81	13.85	84.74	0.0042535	0.02835	100.281
25/06/2021	5	6406	70	12.3	12:34:20	13:24:20	micro_2021-06-25_f0001.txt	aCO2	12.41	11.86	12.04	0	1002.81	13.85	84.74	0.0042535	0.02835	100.281
25/06/2021	5	6373	70	12.3	12:41:30	13:31:30	micro_2021-06-25_f0001.txt	aCO2	12.41	11.86	12.04	0	1002.81	13.85	84.74	0.0042535	0.02835	100.281
25/06/2021	1	8433	70	12.3	12:50:40	13:40:40	micro_2021-06-25_f0001.txt	eCO2	12.51	11.81	13.12	0	1002.81	13.85	84.74	0.0042535	0.02835	100.281
25/06/2021	1	8468	70	12.2	12:58:00	13:48:00	micro_2021-06-25_f0001.txt	eCO2	12.51	11.81	13.12	0	1002.81	13.85	84.74	0.0042535	0.02835	100.281
25/06/2021	1	8445	70	12.4	13:05:00	13:55:00	micro_2021-06-25_f0001.txt	eCO2	12.51	11.81	13.12	0	1002.81	13.85	84.74	0.0042535	0.02835	100.281
25/06/2021	1	8446	70	12.1	13:12:15	14:02:15	micro_2021-06-25_f0001.txt	eCO2	12.68	11.8	13.1	0	1002.56	14.47	80.87	0.0042535	0.02835	100.256
25/06/2021	1	8437	70	12.1	13:19:40	14:09:40	micro_2021-06-25_f0001.txt	eCO2	12.68	11.8	13.1	0	1002.56	14.47	80.87	0.0042535	0.02835	100.256
25/06/2021	3	8357	70	12.4	13:28:30	14:18:30	micro_2021-06-25_f0001.txt	aCO2	12.44	11.7	8.23	0	1002.56	14.47	80.87	0.0042535	0.02835	100.256
25/06/2021	3	9301	70	11.8	13:35:20	14:25:20	micro_2021-06-25_f0001.txt	aCO2	12.44	11.7	8.23	0	1002.56	14.47	80.87	0.0042535	0.02835	100.256
25/06/2021	3	8351	70	12.2	13:42:15	14:32:15	micro_2021-06-25_f0001.txt	aCO2	12.44	11.7	8.23	0	1002.56	14.47	80.87	0.0042535	0.02835	100.256
25/06/2021	3	8345	70	12.5	13:49:25	14:39:25	micro_2021-06-25_f0001.txt	aCO2	12.44	11.7	8.23	0	1002.56	14.47	80.87	0.0042535	0.02835	100.256
25/06/2021	3	8300	70	12.5	13:56:45	14:46:45	micro_2021-06-25_f0001.txt	aCO2	12.44	11.7	8.23	0	1002.56	14.47	80.87	0.0042535	0.02835	100.256
25/06/2021	2	8749	70	12.2	14:05:40	14:55:40	micro_2021-06-25_f0001.txt	aCO2	12.47	11.7	13.75	0	1002.56	14.47	80.87	0.0042535	0.02835	100.256
25/06/2021	2	8668	70	12.1	14:13:05	15:03:05	micro_2021-06-25_f0001.txt	aCO2	12.58	11.7	13.73	0	1002.5	14.45	82.19	0.0042535	0.02835	100.25
25/06/2021	2	8673	70	12.6	14:20:55	15:10:55	micro_2021-06-25_f0001.txt	aCO2	12.58	11.7	13.73	0	1002.5	14.45	82.19	0.0042535	0.02835	100.25
25/06/2021	2	8676	70	12	14:28:00	15:18:00	micro_2021-06-25_f0001.txt	aCO2	12.58	11.7	13.73	0	1002.5	14.45	82.19	0.0042535	0.02835	100.25
25/06/2021	2	8689	70	12.4	14:35:25	15:25:25	micro_2021-06-25_f0001.txt	aCO2	12.58	11.7	13.73	0	1002.5	14.45	82.19	0.0042535	0.02835	100.25
25/06/2021	4	6574	70	12	14:44:50	15:34:50	micro_2021-06-25_f0001.txt	eCO2	12.57	11.86	11.7	0	1002.5	14.45	82.19	0.0042535	0.02835	100.25
25/06/2021	4	6580	70	12	15:02:00	15:52:00	micro_2021-06-25_f0002.txt	eCO2	12.57	11.86	11.7	0	1002.5	14.45	82.19	0.0042535	0.02835	100.25
25/06/2021	4	6518	70	11.9	15:09:45	15:59:45	micro_2021-06-25_f0002.txt	eCO2	12.57	11.86	11.7	0	1002.5	14.45	82.19	0.0042535	0.02835	100.25
25/06/2021	4	6516	70	12.2	15:16:40	16:06:40	micro_2021-06-25_f0002.txt	eCO2	12.55	11.86	11.79	4.79	1002.34	13.45	91.86	0.0042535	0.02835	100.234
25/06/2021	4	6622	70	11.9	15:23:50	16:13:50	micro_2021-06-25_f0002.txt	eCO2	12.55	11.86	11.79	4.79	1002.34	13.45	91.86	0.0042535	0.02835	100.234
19/07/2021	6	5846	30	17.2	08:26:10	09:15:10	micro_2021-07-19_f0000.txt	eCO2	15.96	15.14	10.23	0	1008.94	19.97	83.08	0.002043	0.03178	100.894
19/07/2021	6	5846	70	17.9	08:34:16	09:23:16	micro_2021-07-19_f0000.txt	eCO2	15.96	15.14	10.23	0	1008.94	19.97	83.08	0.0042535	0.02835	100.894
19/07/2021	6	5846	150	17.8	08:41:50	09:30:50	micro_2021-07-19_f0000.txt	eCO2	15.96	15.14	10.23	0	1008.94	19.97	83.08	0.002043	0.03178	100.894
19/07/2021	6	5846	250	18.8	08:52:50	09:41:50	micro_2021-07-19_f0000.txt	eCO2	15.96	15.14	10.23	0	1008.94	19.97	83.08	0.002043	0.03178	100.894
19/07/2021	6	5846	400	18.6	09:00:55	09:49:55	micro_2021-07-19_f0000.txt	eCO2	15.96	15.14	10.23	0	1008.94	19.97	83.08	0.002043	0.03178	100.894
19/07/2021	6	5850	30	17.4	09:10:20	09:59:20	micro_2021-07-19_f0000.txt	eCO2	15.96	15.14	10.23	0	1008.94	19.97	83.08	0.002043	0.03178	100.894
19/07/2021	6	5850	70	18.5	09:18:25	10:07:25	micro_2021-07-19_f0000.txt	eCO2	16.58	15.11	10.2	0	1008.62	22.6	72.48	0.0042535	0.02835	100.862
19/07/2021	6	5850	150	18.9	09:26:35	10:15:35	micro_2021-07-19_f0000.txt	eCO2	16.58	15.11	10.2	0	1008.62	22.6	72.48	0.002043	0.03178	100.862
19/07/2021	6	5850	250	19.3	09:37:30	10:26:30	micro_2021-07-19_f0000.txt	eCO2	16.58	15.11	10.2	0	1008.62	22.6	72.48	0.002043	0.03178	100.862
19/07/2021	6	5850	400	20.4	09:46:55	10:35:55	micro_2021-07-19_f0000.txt	eCO2	16.58	15.11	10.2	0	1008.62	22.6	72.48	0.002043	0.03178	100.862
19/07/2021	6	3752	30	17.8	10:05:15	10:54:15	micro_2021-07-19_f0000.txt	eCO2	16.58	15.11	10.2	0	1008.62	22.6	72.48	0.002043	0.03178	100.862
19/07/2021	6	3752	70	17.2	09:55:45	10:44:45	micro_2021-07-19_f0000.txt	eCO2	16.58	15.11	10.2	0	1008.62	22.6	72.48	0.0042535	0.02835	100.862
19/07/2021	6	3752	150	19	10:16:00	11:05:00	micro_2021-07-19_f0000.txt	eCO2	17.29	15.14	10.19	0	1008.62	24.42	67.31	0.002043	0.03178	100.862
19/07/2021	6	3752	250	19.2	10:26:10	11:15:10	micro_2021-07-19_f0000.txt	eCO2	17.29	15.14	10.19	0	1008.62	24.42	67.31	0.002043	0.03178	100.862
19/07/2021	6	3752	400	20.3	10:36:30	11:25:30	micro_2021-07-19_f0000.txt	eCO2	17.29	15.14	10.19	0	1008.62	24.42	67.31	0.002043	0.03178	100.862
19/07/2021	6	3750	70	19.9	10:46:00	11:35:00	micro_2021-07-19_f0000.txt	eCO2	17.29	15.14	10.19	0	1008.62	24.42	67.31	0.0042535	0.02835	100.862
19/07/2021	6	5844	70	23.2	10:54:50	11:43:50	micro_2021-07-19_f0000.txt	eCO2	17.29	15.14	10.19	0	1008.62	24.42	67.31	0.0042535	0.02835	100.862
19/07/2021	5	6373	30	20.7	11:24:55	12:13:55	micro_2021-07-19_f0000.txt	aCO2	18.25	15.26	14.73	0	1008.34	25.37	64.12	0.002043	0.03178	100.834
19/07/2021	5	6373	70	19.2	11:07:15	11:56:15	micro_2021-07-19_f0000.txt	aCO2	17.63	15.14	14.8	0	1008.62	24.42	67.31	0.0042535	0.02835	100.862
19/07/2021	5	6373	150	20.8	11:36:40	12:25:40	micro_2021-07-19_f0000.txt	aCO2	18.25	15.26	14.73	0	1008.34	25.37	64.12	0.002043	0.03178	100.834
19/07/2021	5	6373	250	21.4	11:50:30	12:39:30	micro_2021-07-19_f0000.txt	aCO2	18.25	15.26	14.73	0	1008.34	25.37	64.12	0.002043	0.03178	100.834
19/07/2021	5	6373	400	21.8	12:02:20	12:51:20	micro_2021-07-19_f0000.txt	aCO2	18.25	15.26	14.73	0	1008.34	25.37	64.12	0.002043	0.03178	100.834
19/07/2021	5	6387	30	19.7	12:13:20	13:02:20	micro_2021-07-19_f0000.txt	aCO2	18.78	15.38	14.65	0	1007.96	26.46	59.92	0.002043	0.03178	100.796
19/07/2021	5	6387	70	20.3	12:30:45	13:19:45	micro_2021-07-19_f0000.txt	aCO2	18.78	15.38	14.65	0	1007.96	26.46	59.92	0.0042535	0.02835	100.796
19/07/2021	5	6387	150	19.8	12:22:20	13:11:20	micro_2021-07-19_f0000.txt	aCO2	18.78	15.38	14.65	0	1007.96	26.46	59.92	0.002043	0.03178	100.796
19/07/2021	5	6387	250	22.2	12:42:00	13:31:00	micro_2021-07-19_f0000.txt	aCO2	18.78	15.38	14.65	0	1007.96	26.46	59.92	0.002043	0.03178	100.796
19/07/2021	5	6387	400	22.1	12:52:55	13:41:55	micro_2021-07-19_f0000.txt	aCO2	18.78	15.38	14.65	0	1007.96	26.46	59.92	0.002043	0.03178	100.796
19/07/2021	5	6382	30	19.4	13:30:54	14:19:54	micro_2021-07-19_f0000.txt	aCO2	19.1	15.52	14.55	0	1007.5	27.49	56.92	0.002043	0.03178	100.75
19/07/2021	5	6382	70	20.6	13:39:40	14:28:40	micro_2021-07-19_f0000.txt	aCO2	19.1	15.52	14.55	0	1007.5	27.49	56.92	0.0042535	0.02835	100.75
19/07/2021	5	6382	150	21	13:48:10	14:37:10	micro_2021-07-19_f0000.txt	aCO2	19.1	15.52	14.55	0	1007.5	27.49	56.92	0.002043	0.03178	100.75
19/07/2021	5	6382	250	21.4	13:57:00	14:46:00	micro_2021-07-19_f0000.txt	aCO2	19.1	15.52	14.55	0	1007.5	27.49	56.92	0.002043	0.03178	100.75
19/07/2021	5	6382	400	23.3	14:06:40	14:55:40	micro_2021-07-19_f0000.txt	aCO2	19.1	15.52	14.55	0	1007.5	27.49	56.92	0.002043	0.03178	100.75
19/07/2021	5	6406	70	18.5	14:14:50	15:03:50	micro_2021-07-19_f0000.txt	aCO2	19.32	15.68	14.49	0	1007.22	27.54	53.44	0.0042535	0.02835	100.722
19/07/2021	5	6384	70	21.7	14:35:30	15:24:30	micro_2021-07-19_f0000.txt	aCO2	19.32	15.68	14.49	0	1007.22	27.54	53.44	0.0042535	0.02835	100.722
19/07/2021	2	8668	30	21.1	14:47:20	15:36:20	micro_2021-07-19_f0000.txt	aCO2	19.05	15	18.73	0	1007.22	27.54	53.44	0.002043	0.03178	100.722
19/07/2021	2	8668	70	20.2	14:58:02	15:47:02	micro_2021-07-19_f0000.txt	aCO2	19.05	15	18.73	0	1007.22	27.54	53.44	0.0042535	0.02835	100.722
19/07/2021	2	8668	150	20.5	15:06:35	15:55:35	micro_2021-07-19_f0000.txt	aCO2	19.05	15	18.73	0	1007.22	27.54	53.44	0.002043	0.03178	100.722
19/07/2021	2	8668	250	21	15:19:00	16:08:00	micro_2021-07-19_f0000.txt	aCO2	19.06	15.11	18.64	0	1006.79	27.66	53.98	0.002043	0.03178	100.679
19/07/2021	2	8668	400	21.7	15:28:30	16:17:30	micro_2021-07-19_f0000.txt	aCO2	19.06	15.11	18.64	0	1006.79	27.66	53.98	0.002043	0.03178	100.679
19/07/2021	2	8749	30	19.5	15:38:30	16:27:30	micro_2021-07-19_f0000.txt	aCO2	19.06	15.11	18.64	0	1006.79	27.66	53.98	0.002043	0.03178	100.679
19/07/2021	2	8749	70	20.2	15:46:10	16:35:10	micro_2021-07-19_f0000.txt	aCO2	19.06	15.11	18.64	0	1006.79	27.66	53.98	0.0042535	0.02835	100.679
19/07/2021	2	8749	150	20.7	15:54:30	16:43:30	micro_2021-07-19_f0000.txt	aCO2	19.06	15.11	18.64	0	1006.79	27.66	53.98	0.002043	0.03178	100.679
19/07/2021	2	8749	250	21.2	16:03:10	16:52:10	micro_2021-07-19_f0000.txt	aCO2	19.06	15.11	18.64	0	1006.79	27.66	53.98	0.002043	0.03178	100.679
19/07/2021	2	8749	400	21.5	16:12:04	17:01:04	micro_2021-07-19_f0000.txt	aCO2	19.08	15.2	18.55	0	1006.31	27.32	54.94	0.002043	0.03178	100.631
19/07/2021	2	8676	70	19.7	16:25:42	17:14:42	micro_2021-07-19_f0000.txt	aCO2	19.08	15.2	18.55	0	1006.31	27.32	54.94	0.0042535	0.02835	100.631
19/07/2021	2	8689	70	20.2	16:33:00	17:22:00	micro_2021-07-19_f0000.txt	aCO2	19.08	15.2	18.55	0	1006.31	27.32	54.94	0.0042535	0.02835	100.631
20/07/2021	2	8673	30	17.4	07:48:31	08:37:31	micro_2021-07-20_f0000.txt	aCO2	15.71	14.8	18.25	0	1006.5	18.06	97.71	0.002043	0.03178	100.65
20/07/2021	2	8673	70	16.8	07:40:20	08:29:20	micro_2021-07-20_f0000.txt	aCO2	15.71	14.8	18.25	0	1006.5	18.06	97.71	0.0042535	0.02835	100.65
20/07/2021	2	8673	150	17.9	07:56:10	08:45:10	micro_2021-07-20_f0000.txt	aCO2	15.71	14.8	18.25	0	1006.5	18.06	97.71	0.002043	0.03178	100.65
20/07/2021	2	8673	250	17.9	08:04:54	08:53:54	micro_2021-07-20_f0000.txt	aCO2	15.71	14.8	18.25	0	1006.5	18.06	97.71	0.002043	0.03178	100.65
20/07/2021	2	8673	400	18.5	08:12:59	09:01:59	micro_2021-07-20_f0000.txt	aCO2	16.18	14.75	18.24	0	1006.5	20.53	88.15	0.002043	0.03178	100.65
20/07/2021	4	6518	30	17.2	08:22:45	09:11:45	micro_2021-07-20_f0000.txt	eCO2	16.25	15.13	15.1	0	1006.5	20.53	88.15	0.002043	0.03178	100.65
20/07/2021	4	6518	70	18.3	08:30:45	09:19:45	micro_2021-07-20_f0000.txt	eCO2	16.25	15.13	15.1	0	1006.5	20.53	88.15	0.0042535	0.02835	100.65
20/07/2021	4	6518	150	18.8	08:39:10	09:28:10	micro_2021-07-20_f0000.txt	eCO2	16.25	15.13	15.1	0	1006.5	20.53	88.15	0.002043	0.03178	100.65
20/07/2021	4	6518	250	18.8	08:47:25	09:36:25	micro_2021-07-20_f0000.txt	eCO2	16.25	15.13	15.1	0	1006.5	20.53	88.15	0.002043	0.03178	100.65
20/07/2021	4	6518	400	19.4	08:56:25	09:45:25	micro_2021-07-20_f0000.txt	eCO2	16.25	15.13	15.1	0	1006.5	20.53	88.15	0.002043	0.03178	100.65
20/07/2021	4	6516	30	19	09:05:21	09:54:21	micro_2021-07-20_f0000.txt	eCO2	16.25	15.13	15.1	0	1006.5	20.53	88.15	0.002043	0.03178	100.65
20/07/2021	4	6516	70	19.9	09:21:50	10:10:50	micro_2021-07-20_f0000.txt	eCO2	16.88	15.12	15.07	0	1006.5	23	78.34	0.0042535	0.02835	100.65
20/07/2021	4	6516	150	20.2	09:14:15	10:03:15	micro_2021-07-20_f0000.txt	eCO2	16.88	15.12	15.07	0	1006.5	23	78.34	0.002043	0.03178	100.65
20/07/2021	4	6516	250	20.4	09:30:00	10:19:00	micro_2021-07-20_f0000.txt	eCO2	16.88	15.12	15.07	0	1006.5	23	78.34	0.002043	0.03178	100.65
20/07/2021	4	6516	400	20.6	09:39:38	10:28:38	micro_2021-07-20_f0000.txt	eCO2	16.88	15.12	15.07	0	1006.5	23	78.34	0.002043	0.03178	100.65
20/07/2021	4	6574	30	20	09:48:25	10:37:25	micro_2021-07-20_f0000.txt	eCO2	16.88	15.12	15.07	0	1006.5	23	78.34	0.002043	0.03178	100.65
20/07/2021	4	6574	70	20.7	09:56:15	10:45:15	micro_2021-07-20_f0000.txt	eCO2	16.88	15.12	15.07	0	1006.5	23	78.34	0.0042535	0.02835	100.65
20/07/2021	4	6574	150	21.6	10:04:55	10:53:55	micro_2021-07-20_f0000.txt	eCO2	16.88	15.12	15.07	0	1006.5	23	78.34	0.002043	0.03178	100.65
20/07/2021	4	6574	250	21.5	10:14:00	11:03:00	micro_2021-07-20_f0000.txt	eCO2	17.5	15.14	15	0	1006.5	24.7	71.17	0.002043	0.03178	100.65
20/07/2021	4	6574	400	21.9	10:23:30	11:12:30	micro_2021-07-20_f0000.txt	eCO2	17.5	15.14	15	0	1006.5	24.7	71.17	0.002043	0.03178	100.65
20/07/2021	4	6580	70	19.9	10:31:26	11:20:26	micro_2021-07-20_f0000.txt	eCO2	17.5	15.14	15	0	1006.5	24.7	71.17	0.0042535	0.02835	100.65
20/07/2021	4	6622	70	19.8	10:39:08	11:28:08	micro_2021-07-20_f0000.txt	eCO2	17.5	15.14	15	0	1006.5	24.7	71.17	0.0042535	0.02835	100.65
20/07/2021	1	8445	30	21.4	11:04:30	11:53:30	micro_2021-07-20_f0000.txt	eCO2	17.5	15.14	15	0	1006.5	24.7	71.17	0.002043	0.03178	100.65
20/07/2021	1	8445	70	18.4	10:52:11	11:41:11	micro_2021-07-20_f0000.txt	eCO2	17.5	15.14	15	0	1006.5	24.7	71.17	0.0042535	0.02835	100.65
20/07/2021	1	8445	150	21.4	11:13:07	12:02:07	micro_2021-07-20_f0000.txt	eCO2	17.5	15.14	15	0	1006.5	25.73	63.54	0.002043	0.03178	100.65
20/07/2021	1	8445	250	22.2	11:24:50	12:13:50	micro_2021-07-20_f0000.txt	eCO2	17.5	15.14	15	0	1006.5	25.73	63.54	0.002043	0.03178	100.65
20/07/2021	1	8445	400	24.2	11:37:10	12:26:10	micro_2021-07-20_f0000.txt	eCO2	17.5	15.14	15	0	1006.5	25.73	63.54	0.002043	0.03178	100.65
20/07/2021	1	8446	30	18	11:46:55	12:35:55	micro_2021-07-20_f0000.txt	eCO2	17.5	15.14	15	0	1006.5	25.73	63.54	0.002043	0.03178	100.65
20/07/2021	1	8446	70	19.5	11:54:38	12:43:38	micro_2021-07-20_f0000.txt	eCO2	17.5	15.14	15	0	1006.5	25.73	63.54	0.0042535	0.02835	100.65
20/07/2021	1	8446	150	19.5	12:03:15	12:52:15	micro_2021-07-20_f0000.txt	eCO2	17.5	15.14	15	0	1006.5	25.73	63.54	0.002043	0.03178	100.65
20/07/2021	1	8446	250	20.8	12:14:45	13:03:45	micro_2021-07-20_f0000.txt	eCO2	17.5	15.14	15	0	1006.5	25.84	66.93	0.002043	0.03178	100.65
20/07/2021	1	8446	400	21.3	12:22:34	13:11:34	micro_2021-07-20_f0000.txt	eCO2	17.5	15.14	15	0	1006.5	25.84	66.93	0.002043	0.03178	100.65
20/07/2021	1	8437	30	20.9	12:34:50	13:23:50	micro_2021-07-20_f0000.txt	eCO2	17.5	15.14	15	0	1006.5	25.84	66.93	0.002043	0.03178	100.65
20/07/2021	1	8437	70	22.6	12:43:02	13:32:02	micro_2021-07-20_f0000.txt	eCO2	17.5	15.14	15	0	1006.5	25.84	66.93	0.0042535	0.02835	100.65
20/07/2021	1	8437	150	22	12:51:05	13:40:05	micro_2021-07-20_f0000.txt	eCO2	17.5	15.14	15	0	1006.5	25.84	66.93	0.002043	0.03178	100.65
20/07/2021	1	8437	250	22.1	12:59:30	13:48:30	micro_2021-07-20_f0000.txt	eCO2	17.5	15.14	15	0	1006.5	25.84	66.93	0.002043	0.03178	100.65
20/07/2021	1	8437	400	22.1	13:09:00	13:58:00	micro_2021-07-20_f0000.txt	eCO2	17.5	15.14	15	0	1006.5	25.84	66.93	0.002043	0.03178	100.65
20/07/2021	1	8468	70	21.2	13:18:19	14:07:19	micro_2021-07-20_f0000.txt	eCO2	17.5	15.14	15	0	1006.5	26.26	65.69	0.0042535	0.02835	100.65
20/07/2021	1	8433	70	21.1	13:27:00	14:16:00	micro_2021-07-20_f0000.txt	eCO2	17.5	15.14	15	0	1006.5	26.26	65.69	0.0042535	0.02835	100.65
20/07/2021	3	8357	30	22.3	14:18:10	15:07:10	micro_2021-07-20_f0000.txt	aCO2	18.43	15.19	9.27	0	1006.53	27.22	59.95	0.002043	0.03178	100.653
20/07/2021	3	8357	70	19.2	14:10:00	14:59:00	micro_2021-07-20_f0000.txt	aCO2	18.01	15.04	9.3	0	1006.5	26.26	65.69	0.0042535	0.02835	100.65
20/07/2021	3	8357	150	20.6	14:26:30	15:15:30	micro_2021-07-20_f0000.txt	aCO2	18.43	15.19	9.27	0	1006.53	27.22	59.95	0.002043	0.03178	100.653
20/07/2021	3	8357	250	22.8	14:34:50	15:23:50	micro_2021-07-20_f0000.txt	aCO2	18.43	15.19	9.27	0	1006.53	27.22	59.95	0.002043	0.03178	100.653
20/07/2021	3	8357	400	24.1	14:43:00	15:32:00	micro_2021-07-20_f0000.txt	aCO2	18.43	15.19	9.27	0	1006.53	27.22	59.95	0.002043	0.03178	100.653
20/07/2021	3	8351	30	21	14:52:30	15:41:30	micro_2021-07-20_f0000.txt	aCO2	18.43	15.19	9.27	0	1006.53	27.22	59.95	0.002043	0.03178	100.653
20/07/2021	3	8351	70	20.5	15:01:15	15:50:15	micro_2021-07-20_f0000.txt	aCO2	18.43	15.19	9.27	0	1006.53	27.22	59.95	0.0042535	0.02835	100.653
20/07/2021	3	8351	150	21.8	15:16:52	16:05:52	micro_2021-07-20_f0000.txt	aCO2	18.65	15.46	9.23	0	1006.47	27.09	58.04	0.002043	0.03178	100.647
20/07/2021	3	8351	250	22.3	15:27:45	16:16:45	micro_2021-07-20_f0000.txt	aCO2	18.65	15.46	9.23	0	1006.47	27.09	58.04	0.002043	0.03178	100.647
20/07/2021	3	8351	400	24	15:36:50	16:25:50	micro_2021-07-20_f0000.txt	aCO2	18.65	15.46	9.23	0	1006.47	27.09	58.04	0.002043	0.03178	100.647
20/07/2021	3	9301	30	21.7	15:46:13	16:35:13	micro_2021-07-20_f0000.txt	aCO2	18.65	15.46	9.23	0	1006.47	27.09	58.04	0.002043	0.03178	100.647
20/07/2021	3	9301	70	21.8	15:53:40	16:42:40	micro_2021-07-20_f0000.txt	aCO2	18.65	15.46	9.23	0	1006.47	27.09	58.04	0.0042535	0.02835	100.647
20/07/2021	3	9301	150	21.9	16:01:22	16:50:22	micro_2021-07-20_f0000.txt	aCO2	18.65	15.46	9.23	0	1006.47	27.09	58.04	0.002043	0.03178	100.647
20/07/2021	3	9301	250	23.4	16:09:00	16:58:00	micro_2021-07-20_f0000.txt	aCO2	18.65	15.46	9.23	0	1006.47	27.09	58.04	0.002043	0.03178	100.647
20/07/2021	3	9301	400	23	16:16:30	17:05:30	micro_2021-07-20_f0000.txt	aCO2	18.71	15.59	9.16	0	1006.5	26.98	57.87	0.002043	0.03178	100.65
20/07/2021	3	8300	70	20.9	16:23:40	17:12:40	micro_2021-07-20_f0000.txt	aCO2	18.71	15.59	9.16	0	1006.5	26.98	57.87	0.0042535	0.02835	100.65
20/07/2021	3	8345	70	22.5	16:30:40	17:19:40	micro_2021-07-20_f0000.txt	aCO2	18.71	15.59	9.16	0	1006.5	26.98	57.87	0.0042535	0.02835	100.65
24/08/2021	6	5846	70	14.1	08:57:56	09:46:56	micro_2021-08-24_f0000.txt	eCO2	14.16	14.11	9.7	0	1018.72	14.98	88.27	0.0042535	0.02835	101.872
24/08/2021	6	5844	70	14.3	09:05:58	09:54:58	micro_2021-08-24_f0000.txt	eCO2	14.16	14.11	9.7	0	1018.72	14.98	88.27	0.0042535	0.02835	101.872
24/08/2021	6	5850	70	14	09:13:21	10:02:21	micro_2021-08-24_f0000.txt	eCO2	14.28	14.1	9.68	0	1019	15.45	87.38	0.0042535	0.02835	101.9
24/08/2021	6	3750	70	14.1	09:21:10	10:10:10	micro_2021-08-24_f0000.txt	eCO2	14.28	14.1	9.68	0	1019	15.45	87.38	0.0042535	0.02835	101.9
24/08/2021	6	3752	70	13.9	09:28:40	10:17:40	micro_2021-08-24_f0000.txt	eCO2	14.28	14.1	9.68	0	1019	15.45	87.38	0.0042535	0.02835	101.9
24/08/2021	5	6373	70	14	09:39:10	10:28:10	micro_2021-08-24_f0000.txt	aCO2	14.34	13.92	12.2	0	1019	15.45	87.38	0.0042535	0.02835	101.9
24/08/2021	5	6387	70	13.9	09:46:45	10:35:45	micro_2021-08-24_f0000.txt	aCO2	14.34	13.92	12.2	0	1019	15.45	87.38	0.0042535	0.02835	101.9
24/08/2021	5	6384	70	14	09:54:15	10:43:15	micro_2021-08-24_f0000.txt	aCO2	14.34	13.92	12.2	0	1019	15.45	87.38	0.0042535	0.02835	101.9
24/08/2021	5	6382	70	14.1	10:01:55	10:50:55	micro_2021-08-24_f0000.txt	aCO2	14.34	13.92	12.2	0	1019	15.45	87.38	0.0042535	0.02835	101.9
24/08/2021	5	6406	70	14.1	10:09:15	10:58:15	micro_2021-08-24_f0000.txt	aCO2	14.34	13.92	12.2	0	1019	15.45	87.38	0.0042535	0.02835	101.9
24/08/2021	1	8433	70	15.4	10:38:40	11:27:40	micro_2021-08-24_f0000.txt	eCO2	14.34	13.92	12.2	0	1019	16.03	85.45	0.0042535	0.02835	101.9
24/08/2021	1	8437	70	15.5	10:47:30	11:36:30	micro_2021-08-24_f0000.txt	eCO2	14.34	13.92	12.2	0	1019	16.03	85.45	0.0042535	0.02835	101.9
24/08/2021	1	8445	70	15.2	10:55:33	11:44:33	micro_2021-08-24_f0000.txt	eCO2	14.34	13.92	12.2	0	1019	16.03	85.45	0.0042535	0.02835	101.9
24/08/2021	1	8446	70	14.6	11:04:15	11:53:15	micro_2021-08-24_f0000.txt	eCO2	14.34	13.92	12.2	0	1019	16.03	85.45	0.0042535	0.02835	101.9
24/08/2021	1	8468	70	14.8	11:12:27	12:01:27	micro_2021-08-24_f0000.txt	eCO2	14.34	13.92	12.2	0	1018.88	16.62	82.57	0.0042535	0.02835	101.888
24/08/2021	3	8357	70	15	11:29:21	12:18:21	micro_2021-08-24_f0001.txt	aCO2	14.39	13.7	7.22	0	1018.88	16.62	82.57	0.0042535	0.02835	101.888
24/08/2021	3	8351	70	14.3	11:37:45	12:26:45	micro_2021-08-24_f0001.txt	aCO2	14.39	13.7	7.22	0	1018.88	16.62	82.57	0.0042535	0.02835	101.888
24/08/2021	3	8345	70	14.7	11:45:45	12:34:45	micro_2021-08-24_f0001.txt	aCO2	14.39	13.7	7.22	0	1018.88	16.62	82.57	0.0042535	0.02835	101.888
24/08/2021	3	8300	70	14.7	11:53:05	12:42:05	micro_2021-08-24_f0001.txt	aCO2	14.39	13.7	7.22	0	1018.88	16.62	82.57	0.0042535	0.02835	101.888
24/08/2021	3	9301	70	14.3	12:01:00	12:50:00	micro_2021-08-24_f0001.txt	aCO2	14.39	13.7	7.22	0	1018.88	16.62	82.57	0.0042535	0.02835	101.888
24/08/2021	4	6574	70	14.6	12:11:35	13:00:35	micro_2021-08-24_f0001.txt	eCO2	14.7	13.94	11.18	0	1018.25	16.61	82.31	0.0042535	0.02835	101.825
24/08/2021	4	6580	70	14.5	12:19:50	13:08:50	micro_2021-08-24_f0001.txt	eCO2	14.7	13.94	11.18	0	1018.25	16.61	82.31	0.0042535	0.02835	101.825
24/08/2021	4	6518	70	14.6	12:32:30	13:21:30	micro_2021-08-24_f0001.txt	eCO2	14.7	13.94	11.18	0	1018.25	16.61	82.31	0.0042535	0.02835	101.825
24/08/2021	4	6516	70	14.9	12:42:10	13:31:10	micro_2021-08-24_f0001.txt	eCO2	14.7	13.94	11.18	0	1018.25	16.61	82.31	0.0042535	0.02835	101.825
24/08/2021	4	6622	70	14.4	12:50:20	13:39:20	micro_2021-08-24_f0001.txt	eCO2	14.7	13.94	11.18	0	1018.25	16.61	82.31	0.0042535	0.02835	101.825
24/08/2021	2	8689	70	15.1	12:59:21	13:48:21	micro_2021-08-24_f0001.txt	aCO2	14.61	13.5	12.67	0	1018.25	16.61	82.31	0.0042535	0.02835	101.825
24/08/2021	2	8676	70	15.1	13:06:50	13:55:50	micro_2021-08-24_f0001.txt	aCO2	14.61	13.5	12.67	0	1018.25	16.61	82.31	0.0042535	0.02835	101.825
24/08/2021	2	8673	70	15	13:15:15	14:04:15	micro_2021-08-24_f0001.txt	aCO2	14.79	13.52	12.61	0	1018.12	17.65	79.1	0.0042535	0.02835	101.812
24/08/2021	2	8668	70	14.8	13:23:25	14:12:25	micro_2021-08-24_f0001.txt	aCO2	14.79	13.52	12.61	0	1018.12	17.65	79.1	0.0042535	0.02835	101.812
24/08/2021	2	8749	70	14.8	13:31:15	14:20:15	micro_2021-08-24_f0001.txt	aCO2	14.79	13.52	12.61	0	1018.12	17.65	79.1	0.0042535	0.02835	101.812
15/09/2021	6	5846	70	11.8	08:39:50	09:26:50	micro_2021-09-15_f0000.txt	eCO2	13.23	13.63	5.39	0	1001.59	13.19	99.45	0.0042535	0.02835	100.159
15/09/2021	6	5844	70	11.8	08:48:20	09:35:20	micro_2021-09-15_f0000.txt	eCO2	13.23	13.63	5.39	0	1001.59	13.19	99.45	0.0042535	0.02835	100.159
15/09/2021	6	3752	70	12.1	08:56:30	09:43:30	micro_2021-09-15_f0000.txt	eCO2	13.23	13.63	5.39	0	1001.59	13.19	99.45	0.0042535	0.02835	100.159
15/09/2021	6	3750	70	12.5	09:04:20	09:51:20	micro_2021-09-15_f0000.txt	eCO2	13.23	13.63	5.39	0	1001.59	13.19	99.45	0.0042535	0.02835	100.159
15/09/2021	6	5850	70	12.2	09:12:00	09:59:00	micro_2021-09-15_f0000.txt	eCO2	13.23	13.63	5.39	0	1001.59	13.19	99.45	0.0042535	0.02835	100.159
15/09/2021	5	6387	70	12.3	09:22:00	10:09:00	micro_2021-09-15_f0000.txt	aCO2	13.49	13.31	7.06	0	1002.08	13.93	98.09	0.0042535	0.02835	100.208
15/09/2021	5	6384	70	12.5	09:29:20	10:16:20	micro_2021-09-15_f0000.txt	aCO2	13.49	13.31	7.06	0	1002.08	13.93	98.09	0.0042535	0.02835	100.208
15/09/2021	5	6382	70	12.8	09:36:40	10:23:40	micro_2021-09-15_f0000.txt	aCO2	13.49	13.31	7.06	0	1002.08	13.93	98.09	0.0042535	0.02835	100.208
15/09/2021	5	6406	70	13.1	09:44:40	10:31:40	micro_2021-09-15_f0000.txt	aCO2	13.49	13.31	7.06	0	1002.08	13.93	98.09	0.0042535	0.02835	100.208
15/09/2021	5	6373	70	13.1	09:52:00	10:39:00	micro_2021-09-15_f0000.txt	aCO2	13.49	13.31	7.06	0	1002.08	13.93	98.09	0.0042535	0.02835	100.208
15/09/2021	1	8433	70	13.5	10:01:30	10:48:30	micro_2021-09-15_f0000.txt	eCO2	13.49	13.31	7.06	0	1002.08	13.93	98.09	0.0042535	0.02835	100.208
15/09/2021	1	8468	70	14	10:10:15	10:57:15	micro_2021-09-15_f0000.txt	eCO2	13.49	13.31	7.06	0	1002.08	13.93	98.09	0.0042535	0.02835	100.208
15/09/2021	1	8445	70	13.8	10:17:35	11:04:35	micro_2021-09-15_f0000.txt	eCO2	13.49	13.31	7.06	0	1001.85	15.25	89.89	0.0042535	0.02835	100.185
15/09/2021	1	8446	70	13.7	10:24:40	11:11:40	micro_2021-09-15_f0000.txt	eCO2	13.49	13.31	7.06	0	1001.85	15.25	89.89	0.0042535	0.02835	100.185
15/09/2021	1	8437	70	13.8	10:32:00	11:19:00	micro_2021-09-15_f0000.txt	eCO2	13.49	13.31	7.06	0	1001.85	15.25	89.89	0.0042535	0.02835	100.185
15/09/2021	3	8357	70	14.1	11:32:15	12:19:15	micro_2021-09-15_f0001.txt	aCO2	14.02	13.32	5.58	0	1002.23	16.36	83.53	0.0042535	0.02835	100.223
15/09/2021	3	9301	70	14.3	11:40:10	12:27:10	micro_2021-09-15_f0001.txt	aCO2	14.02	13.32	5.58	0	1002.23	16.36	83.53	0.0042535	0.02835	100.223
15/09/2021	3	8351	70	14.2	11:47:20	12:34:20	micro_2021-09-15_f0001.txt	aCO2	14.02	13.32	5.58	0	1002.23	16.36	83.53	0.0042535	0.02835	100.223
15/09/2021	3	8345	70	14.3	11:54:25	12:41:25	micro_2021-09-15_f0001.txt	aCO2	14.02	13.32	5.58	0	1002.23	16.36	83.53	0.0042535	0.02835	100.223
15/09/2021	3	8300	70	14.2	12:01:40	12:48:40	micro_2021-09-15_f0001.txt	aCO2	14.02	13.32	5.58	0	1002.23	16.36	83.53	0.0042535	0.02835	100.223
15/09/2021	2	8668	70	14.3	12:11:00	12:58:00	micro_2021-09-15_f0001.txt	aCO2	13.98	13.11	6.47	0	1002.23	16.36	83.53	0.0042535	0.02835	100.223
15/09/2021	2	8749	70	14.4	12:18:15	13:05:15	micro_2021-09-15_f0001.txt	aCO2	14.3	13.14	6.5	0	1002.33	17.4	77.23	0.0042535	0.02835	100.233
15/09/2021	2	8673	70	14.2	12:25:30	13:12:30	micro_2021-09-15_f0001.txt	aCO2	14.3	13.14	6.5	0	1002.33	17.4	77.23	0.0042535	0.02835	100.233
15/09/2021	2	8676	70	14.5	12:32:40	13:19:40	micro_2021-09-15_f0001.txt	aCO2	14.3	13.14	6.5	0	1002.33	17.4	77.23	0.0042535	0.02835	100.233
15/09/2021	2	8689	70	14.3	12:39:40	13:26:40	micro_2021-09-15_f0001.txt	aCO2	14.3	13.14	6.5	0	1002.33	17.4	77.23	0.0042535	0.02835	100.233
15/09/2021	4	6574	70	15.5	12:49:50	13:36:50	micro_2021-09-15_f0001.txt	eCO2	14.39	13.48	7.14	0	1002.33	17.4	77.23	0.0042535	0.02835	100.233
15/09/2021	4	6580	70	14.6	12:57:00	13:44:00	micro_2021-09-15_f0001.txt	eCO2	14.39	13.48	7.14	0	1002.33	17.4	77.23	0.0042535	0.02835	100.233
15/09/2021	4	6518	70	14.6	13:04:10	13:51:10	micro_2021-09-15_f0001.txt	eCO2	14.39	13.48	7.14	0	1002.33	17.4	77.23	0.0042535	0.02835	100.233
15/09/2021	4	6516	70	14.6	13:11:05	13:58:05	micro_2021-09-15_f0001.txt	eCO2	14.39	13.48	7.14	0	1002.33	17.4	77.23	0.0042535	0.02835	100.233
15/09/2021	4	6622	70	14.7	13:18:55	14:05:55	micro_2021-09-15_f0001.txt	eCO2	14.79	13.54	7.11	0	1002.11	18.1	72.98	0.0042535	0.02835	100.211
